frame.number,ip.src,ip.dst,_ws.col.info
1,10.0.0.4,168.63.129.16,Standard query 0xd80d PTR 16.129.63.168.in-addr.arpa
2,168.63.129.16,10.0.0.4,Standard query response 0xd80d No such name PTR 16.129.63.168.in-addr.arpa SOA ns1-02.azure-dns.com
3,10.0.0.4,168.63.129.16,Standard query 0xca54 PTR 115.141.155.57.in-addr.arpa
4,168.63.129.16,10.0.0.4,Standard query response 0xca54 No such name PTR 115.141.155.57.in-addr.arpa SOA ns1-37.azure-dns.com
5,10.0.0.4,57.155.141.115,Application Data
6,10.0.0.4,57.155.141.115,Application Data
7,57.155.141.115,10.0.0.4,443 → 49717 [ACK] Seq=1 Ack=6873 Win=16385 Len=0
8,57.155.141.115,10.0.0.4,Application Data
9,10.0.0.4,57.155.141.115,49717 → 443 [ACK] Seq=6873 Ack=236 Win=2050 Len=0
10,10.0.0.4,8.8.8.8,Echo (ping) request  id=0x0001\, seq=1/256\, ttl=128
11,8.8.8.8,10.0.0.4,Echo (ping) reply    id=0x0001\, seq=1/256\, ttl=115 (request in 10)
12,10.0.0.4,168.63.129.16,Standard query 0x2fe4 PTR 61.55.29.202.in-addr.arpa
13,168.63.129.16,10.0.0.4,Standard query response 0x2fe4 No such name PTR 61.55.29.202.in-addr.arpa SOA ns.apnic.net
14,10.0.0.4,8.8.8.8,Echo (ping) request  id=0x0001\, seq=2/512\, ttl=128
15,8.8.8.8,10.0.0.4,Echo (ping) reply    id=0x0001\, seq=2/512\, ttl=115 (request in 14)
16,10.0.0.4,168.63.129.16,49708 → 80 [RST\, ACK] Seq=1 Ack=1 Win=0 Len=0
17,10.0.0.4,168.63.129.16,49709 → 32526 [RST\, ACK] Seq=1 Ack=1 Win=0 Len=0
18,10.0.0.4,168.63.129.16,PUT /vmAgentLog HTTP/1.1 
19,168.63.129.16,10.0.0.4,HTTP/1.1 100 Continue 
20,10.0.0.4,168.63.129.16,49702 → 32526 [PSH\, ACK] Seq=268 Ack=26 Win=2052 Len=8192
21,10.0.0.4,168.63.129.16,49702 → 32526 [ACK] Seq=8460 Ack=26 Win=2052 Len=5840
22,168.63.129.16,10.0.0.4,32526 → 49702 [ACK] Seq=26 Ack=8460 Win=16385 Len=0
23,10.0.0.4,168.63.129.16,49702 → 32526 [PSH\, ACK] Seq=14300 Ack=26 Win=2052 Len=16060
24,168.63.129.16,10.0.0.4,32526 → 49702 [ACK] Seq=26 Ack=14300 Win=16385 Len=0
25,10.0.0.4,168.63.129.16,49702 → 32526 [PSH\, ACK] Seq=30360 Ack=26 Win=2052 Len=11680
26,168.63.129.16,10.0.0.4,32526 → 49702 [ACK] Seq=26 Ack=42040 Win=16341 Len=0
27,10.0.0.4,168.63.129.16,49702 → 32526 [PSH\, ACK] Seq=42040 Ack=26 Win=2052 Len=39420
28,168.63.129.16,10.0.0.4,[TCP Window Update] 32526 → 49702 [ACK] Seq=26 Ack=42040 Win=16357 Len=0
29,10.0.0.4,168.63.129.16,49702 → 32526 [PSH\, ACK] Seq=81460 Ack=26 Win=2052 Len=1361
30,168.63.129.16,10.0.0.4,32526 → 49702 [ACK] Seq=26 Ack=82821 Win=16213 Len=0
31,10.0.0.4,168.63.129.16,49702 → 32526 [PSH\, ACK] Seq=82821 Ack=26 Win=2052 Len=51100
32,168.63.129.16,10.0.0.4,[TCP Window Update] 32526 → 49702 [ACK] Seq=26 Ack=82821 Win=16229 Len=0
33,168.63.129.16,10.0.0.4,[TCP Window Update] 32526 → 49702 [ACK] Seq=26 Ack=82821 Win=16245 Len=0
34,168.63.129.16,10.0.0.4,[TCP Window Update] 32526 → 49702 [ACK] Seq=26 Ack=82821 Win=16261 Len=0
35,168.63.129.16,10.0.0.4,32526 → 49702 [ACK] Seq=26 Ack=133921 Win=16062 Len=0
36,10.0.0.4,168.63.129.16,49702 → 32526 [PSH\, ACK] Seq=133921 Ack=26 Win=2052 Len=13803
37,168.63.129.16,10.0.0.4,[TCP Window Update] 32526 → 49702 [ACK] Seq=26 Ack=133921 Win=16078 Len=0
38,168.63.129.16,10.0.0.4,[TCP Window Update] 32526 → 49702 [ACK] Seq=26 Ack=133921 Win=16094 Len=0
39,168.63.129.16,10.0.0.4,[TCP Window Update] 32526 → 49702 [ACK] Seq=26 Ack=133921 Win=16110 Len=0
40,168.63.129.16,10.0.0.4,[TCP Window Update] 32526 → 49702 [ACK] Seq=26 Ack=133921 Win=16126 Len=0
41,168.63.129.16,10.0.0.4,[TCP Window Update] 32526 → 49702 [ACK] Seq=26 Ack=133921 Win=16142 Len=0
42,168.63.129.16,10.0.0.4,32526 → 49702 [ACK] Seq=26 Ack=147724 Win=16088 Len=0
43,168.63.129.16,10.0.0.4,[TCP Window Update] 32526 → 49702 [ACK] Seq=26 Ack=147724 Win=16104 Len=0
44,168.63.129.16,10.0.0.4,[TCP Window Update] 32526 → 49702 [ACK] Seq=26 Ack=147724 Win=16120 Len=0
45,168.63.129.16,10.0.0.4,[TCP Window Update] 32526 → 49702 [ACK] Seq=26 Ack=147724 Win=16136 Len=0
46,168.63.129.16,10.0.0.4,[TCP Window Update] 32526 → 49702 [ACK] Seq=26 Ack=147724 Win=16152 Len=0
47,168.63.129.16,10.0.0.4,[TCP Window Update] 32526 → 49702 [ACK] Seq=26 Ack=147724 Win=16168 Len=0
48,168.63.129.16,10.0.0.4,[TCP Window Update] 32526 → 49702 [ACK] Seq=26 Ack=147724 Win=16184 Len=0
49,168.63.129.16,10.0.0.4,[TCP Window Update] 32526 → 49702 [ACK] Seq=26 Ack=147724 Win=16200 Len=0
50,168.63.129.16,10.0.0.4,[TCP Window Update] 32526 → 49702 [ACK] Seq=26 Ack=147724 Win=16216 Len=0
51,168.63.129.16,10.0.0.4,[TCP Window Update] 32526 → 49702 [ACK] Seq=26 Ack=147724 Win=16232 Len=0
52,168.63.129.16,10.0.0.4,[TCP Window Update] 32526 → 49702 [ACK] Seq=26 Ack=147724 Win=16248 Len=0
53,168.63.129.16,10.0.0.4,[TCP Window Update] 32526 → 49702 [ACK] Seq=26 Ack=147724 Win=16264 Len=0
54,168.63.129.16,10.0.0.4,[TCP Window Update] 32526 → 49702 [ACK] Seq=26 Ack=147724 Win=16280 Len=0
55,168.63.129.16,10.0.0.4,[TCP Window Update] 32526 → 49702 [ACK] Seq=26 Ack=147724 Win=16296 Len=0
56,168.63.129.16,10.0.0.4,[TCP Window Update] 32526 → 49702 [ACK] Seq=26 Ack=147724 Win=16312 Len=0
57,168.63.129.16,10.0.0.4,[TCP Window Update] 32526 → 49702 [ACK] Seq=26 Ack=147724 Win=16328 Len=0
58,168.63.129.16,10.0.0.4,[TCP Window Update] 32526 → 49702 [ACK] Seq=26 Ack=147724 Win=16344 Len=0
59,168.63.129.16,10.0.0.4,[TCP Window Update] 32526 → 49702 [ACK] Seq=26 Ack=147724 Win=16360 Len=0
60,168.63.129.16,10.0.0.4,[TCP Window Update] 32526 → 49702 [ACK] Seq=26 Ack=147724 Win=16376 Len=0
61,168.63.129.16,10.0.0.4,[TCP Window Update] 32526 → 49702 [ACK] Seq=26 Ack=147724 Win=16385 Len=0
62,10.0.0.4,168.63.129.16,49718 → 80 [SYN\, ECE\, CWR] Seq=0 Win=64240 Len=0 MSS=1460 WS=256 SACK_PERM
63,168.63.129.16,10.0.0.4,80 → 49718 [SYN\, ACK\, ECE] Seq=0 Ack=1 Win=65535 Len=0 MSS=1460 WS=256 SACK_PERM
64,10.0.0.4,168.63.129.16,49718 → 80 [ACK] Seq=1 Ack=1 Win=525568 Len=0
65,10.0.0.4,168.63.129.16,GET /machine?comp=goalstate HTTP/1.1 
66,168.63.129.16,10.0.0.4,HTTP/1.1 200 OK 
67,168.63.129.16,10.0.0.4,HTTP/1.1 200 OK 
68,10.0.0.4,168.63.129.16,49718 → 80 [ACK] Seq=157 Ack=2216 Win=525568 Len=0
69,10.0.0.4,168.63.129.16,49718 → 80 [FIN\, ACK] Seq=157 Ack=2216 Win=525568 Len=0
70,168.63.129.16,10.0.0.4,80 → 49718 [ACK] Seq=2216 Ack=158 Win=4194560 Len=0
71,10.0.0.4,168.63.129.16,49719 → 80 [SYN\, ECE\, CWR] Seq=0 Win=64240 Len=0 MSS=1460 WS=256 SACK_PERM
72,168.63.129.16,10.0.0.4,80 → 49719 [SYN\, ACK\, ECE] Seq=0 Ack=1 Win=65535 Len=0 MSS=1460 WS=256 SACK_PERM
73,10.0.0.4,168.63.129.16,49719 → 80 [ACK] Seq=1 Ack=1 Win=525568 Len=0
74,10.0.0.4,168.63.129.16,GET /machine/aab8027a-acae-4d1a-9574-4723c316076c/66359768%2D3838%2D40b0%2Db402%2D8b3427650d4b.%5Fwin?comp=config&type=hostingEnvironmentConfig&incarnation=1 HTTP/1.1 
75,168.63.129.16,10.0.0.4,HTTP/1.1 200 OK 
76,168.63.129.16,10.0.0.4,HTTP/1.1 200 OK 
77,10.0.0.4,168.63.129.16,49719 → 80 [ACK] Seq=287 Ack=1612 Win=525568 Len=0
78,10.0.0.4,168.63.129.16,49719 → 80 [FIN\, ACK] Seq=287 Ack=1612 Win=525568 Len=0
79,168.63.129.16,10.0.0.4,80 → 49719 [ACK] Seq=1612 Ack=288 Win=4194304 Len=0
80,10.0.0.4,168.63.129.16,49720 → 80 [SYN\, ECE\, CWR] Seq=0 Win=64240 Len=0 MSS=1460 WS=256 SACK_PERM
81,168.63.129.16,10.0.0.4,80 → 49720 [SYN\, ACK\, ECE] Seq=0 Ack=1 Win=65535 Len=0 MSS=1460 WS=256 SACK_PERM
82,10.0.0.4,168.63.129.16,49720 → 80 [ACK] Seq=1 Ack=1 Win=525568 Len=0
83,10.0.0.4,168.63.129.16,GET /machine/aab8027a-acae-4d1a-9574-4723c316076c/66359768%2D3838%2D40b0%2Db402%2D8b3427650d4b.%5Fwin?comp=config&type=hostingEnvironmentConfig&incarnation=1 HTTP/1.1 
84,168.63.129.16,10.0.0.4,HTTP/1.1 200 OK 
85,168.63.129.16,10.0.0.4,HTTP/1.1 200 OK 
86,10.0.0.4,168.63.129.16,49720 → 80 [ACK] Seq=287 Ack=1612 Win=525568 Len=0
87,10.0.0.4,168.63.129.16,49720 → 80 [FIN\, ACK] Seq=287 Ack=1612 Win=525568 Len=0
88,168.63.129.16,10.0.0.4,80 → 49720 [ACK] Seq=1612 Ack=288 Win=4194304 Len=0
89,10.0.0.4,168.63.129.16,49721 → 80 [SYN\, ECE\, CWR] Seq=0 Win=64240 Len=0 MSS=1460 WS=256 SACK_PERM
90,168.63.129.16,10.0.0.4,80 → 49721 [SYN\, ACK\, ECE] Seq=0 Ack=1 Win=65535 Len=0 MSS=1460 WS=256 SACK_PERM
91,10.0.0.4,168.63.129.16,49721 → 80 [ACK] Seq=1 Ack=1 Win=525568 Len=0
92,10.0.0.4,168.63.129.16,GET /machine/aab8027a-acae-4d1a-9574-4723c316076c/66359768%2D3838%2D40b0%2Db402%2D8b3427650d4b.%5Fwin?comp=config&type=sharedConfig&incarnation=1 HTTP/1.1 
93,168.63.129.16,10.0.0.4,HTTP/1.1 200 OK 
94,10.0.0.4,168.63.129.16,49721 → 80 [ACK] Seq=275 Ack=1034 Win=524544 Len=0
95,10.0.0.4,168.63.129.16,49721 → 80 [FIN\, ACK] Seq=275 Ack=1034 Win=524544 Len=0
96,10.0.0.4,168.63.129.16,49722 → 80 [SYN\, ECE\, CWR] Seq=0 Win=64240 Len=0 MSS=1460 WS=256 SACK_PERM
97,168.63.129.16,10.0.0.4,80 → 49721 [ACK] Seq=1034 Ack=276 Win=4194304 Len=0
98,168.63.129.16,10.0.0.4,80 → 49722 [SYN\, ACK\, ECE] Seq=0 Ack=1 Win=65535 Len=0 MSS=1460 WS=256 SACK_PERM
99,10.0.0.4,168.63.129.16,49722 → 80 [ACK] Seq=1 Ack=1 Win=525568 Len=0
100,10.0.0.4,168.63.129.16,GET /machine/aab8027a-acae-4d1a-9574-4723c316076c/66359768%2D3838%2D40b0%2Db402%2D8b3427650d4b.%5Fwin?comp=config&type=extensionsConfig&incarnation=1 HTTP/1.1 
101,168.63.129.16,10.0.0.4,HTTP/1.1 200 OK 
102,168.63.129.16,10.0.0.4,80 → 49722 [ACK] Seq=1441 Ack=279 Win=4194304 Len=1440
103,168.63.129.16,10.0.0.4,80 → 49722 [ACK] Seq=2881 Ack=279 Win=4194304 Len=1440
104,168.63.129.16,10.0.0.4,80 → 49722 [ACK] Seq=4321 Ack=279 Win=4194304 Len=1440
105,168.63.129.16,10.0.0.4,HTTP/1.1 200 OK 
106,10.0.0.4,168.63.129.16,49722 → 80 [ACK] Seq=279 Ack=5818 Win=525568 Len=0
107,10.0.0.4,168.63.129.16,49722 → 80 [FIN\, ACK] Seq=279 Ack=5818 Win=525568 Len=0
108,168.63.129.16,10.0.0.4,80 → 49722 [ACK] Seq=5818 Ack=280 Win=4194304 Len=0
109,10.0.0.4,168.63.129.16,GET /vmSettings HTTP/1.1 
110,168.63.129.16,10.0.0.4,HTTP/1.1 304 Not Modified 
111,10.0.0.4,168.63.129.16,49679 → 32526 [ACK] Seq=230 Ack=158 Win=16382 Len=0
112,10.0.0.4,168.63.129.16,49702 → 32526 [PSH\, ACK] Seq=147724 Ack=26 Win=2052 Len=8192
113,10.0.0.4,168.63.129.16,49702 → 32526 [PSH\, ACK] Seq=155916 Ack=26 Win=2052 Len=8192
114,10.0.0.4,168.63.129.16,49702 → 32526 [PSH\, ACK] Seq=164108 Ack=26 Win=2052 Len=8192
115,10.0.0.4,168.63.129.16,49702 → 32526 [PSH\, ACK] Seq=172300 Ack=26 Win=2052 Len=8192
116,10.0.0.4,168.63.129.16,49702 → 32526 [PSH\, ACK] Seq=180492 Ack=26 Win=2052 Len=8192
117,10.0.0.4,168.63.129.16,49702 → 32526 [PSH\, ACK] Seq=188684 Ack=26 Win=2052 Len=8192
118,10.0.0.4,168.63.129.16,49702 → 32526 [PSH\, ACK] Seq=196876 Ack=26 Win=2052 Len=8192
119,10.0.0.4,168.63.129.16,49702 → 32526 [PSH\, ACK] Seq=205068 Ack=26 Win=2052 Len=8192
120,10.0.0.4,168.63.129.16,49702 → 32526 [PSH\, ACK] Seq=213260 Ack=26 Win=2052 Len=8192
121,10.0.0.4,168.63.129.16,49702 → 32526 [ACK] Seq=221452 Ack=26 Win=2052 Len=1460
122,168.63.129.16,10.0.0.4,32526 → 49702 [ACK] Seq=26 Ack=222912 Win=16155 Len=0
123,10.0.0.4,168.63.129.16,49702 → 32526 [PSH\, ACK] Seq=222912 Ack=26 Win=2052 Len=62780
124,10.0.0.4,168.63.129.16,49702 → 32526 [PSH\, ACK] Seq=285692 Ack=26 Win=2052 Len=1296
125,168.63.129.16,10.0.0.4,[TCP Window Update] 32526 → 49702 [ACK] Seq=26 Ack=222912 Win=16171 Len=0
126,168.63.129.16,10.0.0.4,[TCP Window Update] 32526 → 49702 [ACK] Seq=26 Ack=222912 Win=16187 Len=0
127,10.0.0.4,168.63.129.16,49702 → 32526 [PSH\, ACK] Seq=286988 Ack=26 Win=2052 Len=8192
128,10.0.0.4,168.63.129.16,49702 → 32526 [PSH\, ACK] Seq=295180 Ack=26 Win=2052 Len=8192
129,10.0.0.4,168.63.129.16,49702 → 32526 [ACK] Seq=303372 Ack=26 Win=2052 Len=5840
130,168.63.129.16,10.0.0.4,[TCP Window Update] 32526 → 49702 [ACK] Seq=26 Ack=222912 Win=16203 Len=0
131,168.63.129.16,10.0.0.4,[TCP Window Update] 32526 → 49702 [ACK] Seq=26 Ack=222912 Win=16219 Len=0
132,168.63.129.16,10.0.0.4,[TCP Window Update] 32526 → 49702 [ACK] Seq=26 Ack=222912 Win=16235 Len=0
133,168.63.129.16,10.0.0.4,[TCP Window Update] 32526 → 49702 [ACK] Seq=26 Ack=222912 Win=16251 Len=0
134,168.63.129.16,10.0.0.4,[TCP Window Update] 32526 → 49702 [ACK] Seq=26 Ack=222912 Win=16267 Len=0
135,168.63.129.16,10.0.0.4,[TCP Window Update] 32526 → 49702 [ACK] Seq=26 Ack=222912 Win=16283 Len=0
136,168.63.129.16,10.0.0.4,[TCP Window Update] 32526 → 49702 [ACK] Seq=26 Ack=222912 Win=16299 Len=0
137,168.63.129.16,10.0.0.4,[TCP Window Update] 32526 → 49702 [ACK] Seq=26 Ack=222912 Win=16315 Len=0
138,168.63.129.16,10.0.0.4,[TCP Window Update] 32526 → 49702 [ACK] Seq=26 Ack=222912 Win=16331 Len=0
139,168.63.129.16,10.0.0.4,[TCP Window Update] 32526 → 49702 [ACK] Seq=26 Ack=222912 Win=16347 Len=0
140,168.63.129.16,10.0.0.4,[TCP Window Update] 32526 → 49702 [ACK] Seq=26 Ack=222912 Win=16363 Len=0
141,168.63.129.16,10.0.0.4,[TCP Window Update] 32526 → 49702 [ACK] Seq=26 Ack=222912 Win=16379 Len=0
142,168.63.129.16,10.0.0.4,32526 → 49702 [ACK] Seq=26 Ack=309212 Win=16058 Len=0
143,10.0.0.4,168.63.129.16,49702 → 32526 [PSH\, ACK] Seq=309212 Ack=26 Win=2052 Len=51504
144,168.63.129.16,10.0.0.4,[TCP Window Update] 32526 → 49702 [ACK] Seq=26 Ack=309212 Win=16042 Len=0
145,168.63.129.16,10.0.0.4,[TCP Window Update] 32526 → 49702 [ACK] Seq=26 Ack=309212 Win=16074 Len=0
146,168.63.129.16,10.0.0.4,[TCP Window Update] 32526 → 49702 [ACK] Seq=26 Ack=309212 Win=16090 Len=0
147,168.63.129.16,10.0.0.4,[TCP Window Update] 32526 → 49702 [ACK] Seq=26 Ack=309212 Win=16106 Len=0
148,168.63.129.16,10.0.0.4,[TCP Window Update] 32526 → 49702 [ACK] Seq=26 Ack=309212 Win=16122 Len=0
149,168.63.129.16,10.0.0.4,[TCP Window Update] 32526 → 49702 [ACK] Seq=26 Ack=309212 Win=16138 Len=0
150,168.63.129.16,10.0.0.4,[TCP Window Update] 32526 → 49702 [ACK] Seq=26 Ack=309212 Win=16154 Len=0
151,168.63.129.16,10.0.0.4,32526 → 49702 [ACK] Seq=26 Ack=360716 Win=15969 Len=0
152,168.63.129.16,10.0.0.4,[TCP Window Update] 32526 → 49702 [ACK] Seq=26 Ack=360716 Win=15953 Len=0
153,168.63.129.16,10.0.0.4,[TCP Window Update] 32526 → 49702 [ACK] Seq=26 Ack=360716 Win=15985 Len=0
154,168.63.129.16,10.0.0.4,[TCP Window Update] 32526 → 49702 [ACK] Seq=26 Ack=360716 Win=16001 Len=0
155,10.0.0.4,168.63.129.16,49702 → 32526 [PSH\, ACK] Seq=360716 Ack=26 Win=2052 Len=8192
156,168.63.129.16,10.0.0.4,[TCP Window Update] 32526 → 49702 [ACK] Seq=26 Ack=360716 Win=16017 Len=0
157,168.63.129.16,10.0.0.4,[TCP Window Update] 32526 → 49702 [ACK] Seq=26 Ack=360716 Win=16033 Len=0
158,168.63.129.16,10.0.0.4,[TCP Window Update] 32526 → 49702 [ACK] Seq=26 Ack=360716 Win=16049 Len=0
159,168.63.129.16,10.0.0.4,[TCP Window Update] 32526 → 49702 [ACK] Seq=26 Ack=360716 Win=16065 Len=0
160,10.0.0.4,168.63.129.16,49702 → 32526 [PSH\, ACK] Seq=368908 Ack=26 Win=2052 Len=8192
161,168.63.129.16,10.0.0.4,[TCP Window Update] 32526 → 49702 [ACK] Seq=26 Ack=360716 Win=16081 Len=0
162,168.63.129.16,10.0.0.4,[TCP Window Update] 32526 → 49702 [ACK] Seq=26 Ack=360716 Win=16097 Len=0
163,168.63.129.16,10.0.0.4,32526 → 49702 [ACK] Seq=26 Ack=368908 Win=16065 Len=0
164,168.63.129.16,10.0.0.4,[TCP Window Update] 32526 → 49702 [ACK] Seq=26 Ack=368908 Win=16081 Len=0
165,168.63.129.16,10.0.0.4,[TCP Window Update] 32526 → 49702 [ACK] Seq=26 Ack=368908 Win=16097 Len=0
166,168.63.129.16,10.0.0.4,32526 → 49702 [ACK] Seq=26 Ack=377100 Win=16065 Len=0
167,168.63.129.16,10.0.0.4,[TCP Window Update] 32526 → 49702 [ACK] Seq=26 Ack=377100 Win=16081 Len=0
168,168.63.129.16,10.0.0.4,[TCP Window Update] 32526 → 49702 [ACK] Seq=26 Ack=377100 Win=16097 Len=0
169,168.63.129.16,10.0.0.4,[TCP Window Update] 32526 → 49702 [ACK] Seq=26 Ack=377100 Win=16113 Len=0
170,168.63.129.16,10.0.0.4,[TCP Window Update] 32526 → 49702 [ACK] Seq=26 Ack=377100 Win=16129 Len=0
171,168.63.129.16,10.0.0.4,[TCP Window Update] 32526 → 49702 [ACK] Seq=26 Ack=377100 Win=16145 Len=0
172,10.0.0.4,168.63.129.16,49702 → 32526 [PSH\, ACK] Seq=377100 Ack=26 Win=2052 Len=8192
173,168.63.129.16,10.0.0.4,[TCP Window Update] 32526 → 49702 [ACK] Seq=26 Ack=377100 Win=16161 Len=0
174,168.63.129.16,10.0.0.4,[TCP Window Update] 32526 → 49702 [ACK] Seq=26 Ack=377100 Win=16177 Len=0
175,168.63.129.16,10.0.0.4,[TCP Window Update] 32526 → 49702 [ACK] Seq=26 Ack=377100 Win=16193 Len=0
176,168.63.129.16,10.0.0.4,[TCP Window Update] 32526 → 49702 [ACK] Seq=26 Ack=377100 Win=16209 Len=0
177,168.63.129.16,10.0.0.4,[TCP Window Update] 32526 → 49702 [ACK] Seq=26 Ack=377100 Win=16225 Len=0
178,168.63.129.16,10.0.0.4,[TCP Window Update] 32526 → 49702 [ACK] Seq=26 Ack=377100 Win=16241 Len=0
179,168.63.129.16,10.0.0.4,[TCP Window Update] 32526 → 49702 [ACK] Seq=26 Ack=377100 Win=16257 Len=0
180,168.63.129.16,10.0.0.4,[TCP Window Update] 32526 → 49702 [ACK] Seq=26 Ack=377100 Win=16273 Len=0
181,10.0.0.4,168.63.129.16,49702 → 32526 [PSH\, ACK] Seq=385292 Ack=26 Win=2052 Len=8192
182,10.0.0.4,168.63.129.16,49702 → 32526 [PSH\, ACK] Seq=393484 Ack=26 Win=2052 Len=8192
183,168.63.129.16,10.0.0.4,32526 → 49702 [ACK] Seq=26 Ack=385292 Win=16241 Len=0
184,168.63.129.16,10.0.0.4,[TCP Window Update] 32526 → 49702 [ACK] Seq=26 Ack=385292 Win=16257 Len=0
185,10.0.0.4,168.63.129.16,49702 → 32526 [PSH\, ACK] Seq=401676 Ack=26 Win=2052 Len=8192
186,10.0.0.4,168.63.129.16,49702 → 32526 [PSH\, ACK] Seq=409868 Ack=26 Win=2052 Len=8192
187,168.63.129.16,10.0.0.4,32526 → 49702 [ACK] Seq=26 Ack=401676 Win=16193 Len=0
188,168.63.129.16,10.0.0.4,[TCP Window Update] 32526 → 49702 [ACK] Seq=26 Ack=401676 Win=16209 Len=0
189,10.0.0.4,168.63.129.16,49702 → 32526 [PSH\, ACK] Seq=418060 Ack=26 Win=2052 Len=8192
190,168.63.129.16,10.0.0.4,[TCP Window Update] 32526 → 49702 [ACK] Seq=26 Ack=401676 Win=16225 Len=0
191,10.0.0.4,168.63.129.16,49702 → 32526 [PSH\, ACK] Seq=426252 Ack=26 Win=2052 Len=8192
192,10.0.0.4,168.63.129.16,49702 → 32526 [PSH\, ACK] Seq=434444 Ack=26 Win=2052 Len=8192
193,168.63.129.16,10.0.0.4,32526 → 49702 [ACK] Seq=26 Ack=418060 Win=16161 Len=0
194,168.63.129.16,10.0.0.4,[TCP Window Update] 32526 → 49702 [ACK] Seq=26 Ack=418060 Win=16177 Len=0
195,168.63.129.16,10.0.0.4,32526 → 49702 [ACK] Seq=26 Ack=434444 Win=16113 Len=0
196,168.63.129.16,10.0.0.4,[TCP Window Update] 32526 → 49702 [ACK] Seq=26 Ack=434444 Win=16129 Len=0
197,168.63.129.16,10.0.0.4,32526 → 49702 [ACK] Seq=26 Ack=442636 Win=16097 Len=0
198,10.0.0.4,168.63.129.16,49702 → 32526 [PSH\, ACK] Seq=442636 Ack=26 Win=2052 Len=8192
199,10.0.0.4,168.63.129.16,49702 → 32526 [PSH\, ACK] Seq=450828 Ack=26 Win=2052 Len=8192
200,10.0.0.4,168.63.129.16,49702 → 32526 [PSH\, ACK] Seq=459020 Ack=26 Win=2052 Len=8192
201,168.63.129.16,10.0.0.4,[TCP Window Update] 32526 → 49702 [ACK] Seq=26 Ack=442636 Win=16113 Len=0
202,168.63.129.16,10.0.0.4,[TCP Window Update] 32526 → 49702 [ACK] Seq=26 Ack=442636 Win=16129 Len=0
203,168.63.129.16,10.0.0.4,[TCP Window Update] 32526 → 49702 [ACK] Seq=26 Ack=442636 Win=16145 Len=0
204,10.0.0.4,168.63.129.16,49702 → 32526 [PSH\, ACK] Seq=467212 Ack=26 Win=2052 Len=8192
205,10.0.0.4,168.63.129.16,49702 → 32526 [PSH\, ACK] Seq=475404 Ack=26 Win=2052 Len=8192
206,168.63.129.16,10.0.0.4,[TCP Window Update] 32526 → 49702 [ACK] Seq=26 Ack=442636 Win=16161 Len=0
207,168.63.129.16,10.0.0.4,32526 → 49702 [ACK] Seq=26 Ack=467212 Win=16065 Len=0
208,168.63.129.16,10.0.0.4,[TCP Window Update] 32526 → 49702 [ACK] Seq=26 Ack=467212 Win=16081 Len=0
209,168.63.129.16,10.0.0.4,[TCP Window Update] 32526 → 49702 [ACK] Seq=26 Ack=467212 Win=16097 Len=0
210,10.0.0.4,168.63.129.16,49702 → 32526 [PSH\, ACK] Seq=483596 Ack=26 Win=2052 Len=8192
211,168.63.129.16,10.0.0.4,32526 → 49702 [ACK] Seq=26 Ack=483596 Win=16033 Len=0
212,168.63.129.16,10.0.0.4,[TCP Window Update] 32526 → 49702 [ACK] Seq=26 Ack=483596 Win=16049 Len=0
213,10.0.0.4,168.63.129.16,49702 → 32526 [PSH\, ACK] Seq=491788 Ack=26 Win=2052 Len=8192
214,168.63.129.16,10.0.0.4,32526 → 49702 [ACK] Seq=26 Ack=491788 Win=16017 Len=0
215,168.63.129.16,10.0.0.4,[TCP Window Update] 32526 → 49702 [ACK] Seq=26 Ack=491788 Win=16033 Len=0
216,10.0.0.4,168.63.129.16,49702 → 32526 [PSH\, ACK] Seq=499980 Ack=26 Win=2052 Len=8192
217,10.0.0.4,168.63.129.16,49702 → 32526 [PSH\, ACK] Seq=508172 Ack=26 Win=2052 Len=8192
218,168.63.129.16,10.0.0.4,[TCP Window Update] 32526 → 49702 [ACK] Seq=26 Ack=491788 Win=16049 Len=0
219,168.63.129.16,10.0.0.4,32526 → 49702 [ACK] Seq=26 Ack=499980 Win=16017 Len=0
220,168.63.129.16,10.0.0.4,[TCP Window Update] 32526 → 49702 [ACK] Seq=26 Ack=499980 Win=16033 Len=0
221,168.63.129.16,10.0.0.4,32526 → 49702 [ACK] Seq=26 Ack=508172 Win=16001 Len=0
222,168.63.129.16,10.0.0.4,[TCP Window Update] 32526 → 49702 [ACK] Seq=26 Ack=508172 Win=16017 Len=0
223,10.0.0.4,168.63.129.16,49702 → 32526 [PSH\, ACK] Seq=516364 Ack=26 Win=2052 Len=8192
224,168.63.129.16,10.0.0.4,[TCP Window Update] 32526 → 49702 [ACK] Seq=26 Ack=508172 Win=16033 Len=0
225,168.63.129.16,10.0.0.4,32526 → 49702 [ACK] Seq=26 Ack=516364 Win=16001 Len=0
226,168.63.129.16,10.0.0.4,[TCP Window Update] 32526 → 49702 [ACK] Seq=26 Ack=516364 Win=16017 Len=0
227,168.63.129.16,10.0.0.4,[TCP Window Update] 32526 → 49702 [ACK] Seq=26 Ack=516364 Win=16033 Len=0
228,168.63.129.16,10.0.0.4,[TCP Window Update] 32526 → 49702 [ACK] Seq=26 Ack=516364 Win=16049 Len=0
229,10.0.0.4,168.63.129.16,49702 → 32526 [PSH\, ACK] Seq=524556 Ack=26 Win=2052 Len=8192
230,168.63.129.16,10.0.0.4,32526 → 49702 [ACK] Seq=26 Ack=524556 Win=16017 Len=0
231,168.63.129.16,10.0.0.4,[TCP Window Update] 32526 → 49702 [ACK] Seq=26 Ack=524556 Win=16033 Len=0
232,168.63.129.16,10.0.0.4,[TCP Window Update] 32526 → 49702 [ACK] Seq=26 Ack=524556 Win=16049 Len=0
233,168.63.129.16,10.0.0.4,[TCP Window Update] 32526 → 49702 [ACK] Seq=26 Ack=524556 Win=16065 Len=0
234,168.63.129.16,10.0.0.4,32526 → 49702 [ACK] Seq=26 Ack=532748 Win=16033 Len=0
235,168.63.129.16,10.0.0.4,[TCP Window Update] 32526 → 49702 [ACK] Seq=26 Ack=532748 Win=16049 Len=0
236,168.63.129.16,10.0.0.4,[TCP Window Update] 32526 → 49702 [ACK] Seq=26 Ack=532748 Win=16065 Len=0
237,168.63.129.16,10.0.0.4,[TCP Window Update] 32526 → 49702 [ACK] Seq=26 Ack=532748 Win=16081 Len=0
238,168.63.129.16,10.0.0.4,[TCP Window Update] 32526 → 49702 [ACK] Seq=26 Ack=532748 Win=16097 Len=0
239,10.0.0.4,168.63.129.16,49702 → 32526 [PSH\, ACK] Seq=532748 Ack=26 Win=2052 Len=8192
240,168.63.129.16,10.0.0.4,[TCP Window Update] 32526 → 49702 [ACK] Seq=26 Ack=532748 Win=16113 Len=0
241,10.0.0.4,168.63.129.16,49702 → 32526 [PSH\, ACK] Seq=540940 Ack=26 Win=2052 Len=8192
242,168.63.129.16,10.0.0.4,[TCP Window Update] 32526 → 49702 [ACK] Seq=26 Ack=532748 Win=16129 Len=0
243,168.63.129.16,10.0.0.4,32526 → 49702 [ACK] Seq=26 Ack=540940 Win=16097 Len=0
244,168.63.129.16,10.0.0.4,[TCP Window Update] 32526 → 49702 [ACK] Seq=26 Ack=540940 Win=16113 Len=0
245,10.0.0.4,168.63.129.16,49702 → 32526 [PSH\, ACK] Seq=549132 Ack=26 Win=2052 Len=8192
246,168.63.129.16,10.0.0.4,32526 → 49702 [ACK] Seq=26 Ack=549132 Win=16081 Len=0
247,168.63.129.16,10.0.0.4,[TCP Window Update] 32526 → 49702 [ACK] Seq=26 Ack=549132 Win=16097 Len=0
248,10.0.0.4,168.63.129.16,49702 → 32526 [PSH\, ACK] Seq=557324 Ack=26 Win=2052 Len=8192
249,10.0.0.4,168.63.129.16,49702 → 32526 [PSH\, ACK] Seq=565516 Ack=26 Win=2052 Len=8192
250,10.0.0.4,168.63.129.16,49702 → 32526 [PSH\, ACK] Seq=573708 Ack=26 Win=2052 Len=8192
251,168.63.129.16,10.0.0.4,32526 → 49702 [ACK] Seq=26 Ack=557324 Win=16065 Len=0
252,168.63.129.16,10.0.0.4,[TCP Window Update] 32526 → 49702 [ACK] Seq=26 Ack=557324 Win=16081 Len=0
253,10.0.0.4,168.63.129.16,49702 → 32526 [PSH\, ACK] Seq=581900 Ack=26 Win=2052 Len=8192
254,168.63.129.16,10.0.0.4,32526 → 49702 [ACK] Seq=26 Ack=573708 Win=16017 Len=0
255,168.63.129.16,10.0.0.4,[TCP Window Update] 32526 → 49702 [ACK] Seq=26 Ack=573708 Win=16033 Len=0
256,168.63.129.16,10.0.0.4,32526 → 49702 [ACK] Seq=26 Ack=581900 Win=16001 Len=0
257,168.63.129.16,10.0.0.4,[TCP Window Update] 32526 → 49702 [ACK] Seq=26 Ack=581900 Win=16017 Len=0
258,10.0.0.4,168.63.129.16,49702 → 32526 [PSH\, ACK] Seq=590092 Ack=26 Win=2052 Len=8192
259,168.63.129.16,10.0.0.4,32526 → 49702 [ACK] Seq=26 Ack=590092 Win=15985 Len=0
260,168.63.129.16,10.0.0.4,[TCP Window Update] 32526 → 49702 [ACK] Seq=26 Ack=590092 Win=16001 Len=0
261,10.0.0.4,168.63.129.16,49702 → 32526 [PSH\, ACK] Seq=598284 Ack=26 Win=2052 Len=8192
262,168.63.129.16,10.0.0.4,[TCP Window Update] 32526 → 49702 [ACK] Seq=26 Ack=590092 Win=16017 Len=0
263,168.63.129.16,10.0.0.4,[TCP Window Update] 32526 → 49702 [ACK] Seq=26 Ack=590092 Win=16033 Len=0
264,10.0.0.4,168.63.129.16,49702 → 32526 [PSH\, ACK] Seq=606476 Ack=26 Win=2052 Len=8192
265,10.0.0.4,168.63.129.16,49702 → 32526 [PSH\, ACK] Seq=614668 Ack=26 Win=2052 Len=8192
266,168.63.129.16,10.0.0.4,[TCP Window Update] 32526 → 49702 [ACK] Seq=26 Ack=590092 Win=16049 Len=0
267,168.63.129.16,10.0.0.4,32526 → 49702 [ACK] Seq=26 Ack=606476 Win=15985 Len=0
268,168.63.129.16,10.0.0.4,[TCP Window Update] 32526 → 49702 [ACK] Seq=26 Ack=606476 Win=16001 Len=0
269,10.0.0.4,168.63.129.16,49702 → 32526 [PSH\, ACK] Seq=622860 Ack=26 Win=2052 Len=8192
270,10.0.0.4,168.63.129.16,49702 → 32526 [PSH\, ACK] Seq=631052 Ack=26 Win=2052 Len=8192
271,168.63.129.16,10.0.0.4,32526 → 49702 [ACK] Seq=26 Ack=622860 Win=15937 Len=0
272,168.63.129.16,10.0.0.4,[TCP Window Update] 32526 → 49702 [ACK] Seq=26 Ack=622860 Win=15953 Len=0
273,10.0.0.4,168.63.129.16,49702 → 32526 [PSH\, ACK] Seq=639244 Ack=26 Win=2052 Len=8192
274,168.63.129.16,10.0.0.4,[TCP Window Update] 32526 → 49702 [ACK] Seq=26 Ack=622860 Win=15969 Len=0
275,168.63.129.16,10.0.0.4,[TCP Window Update] 32526 → 49702 [ACK] Seq=26 Ack=622860 Win=15985 Len=0
276,168.63.129.16,10.0.0.4,32526 → 49702 [ACK] Seq=26 Ack=631052 Win=15953 Len=0
277,10.0.0.4,168.63.129.16,49702 → 32526 [PSH\, ACK] Seq=647436 Ack=26 Win=2052 Len=8192
278,10.0.0.4,168.63.129.16,49702 → 32526 [PSH\, ACK] Seq=655628 Ack=26 Win=2052 Len=8192
279,168.63.129.16,10.0.0.4,[TCP Window Update] 32526 → 49702 [ACK] Seq=26 Ack=631052 Win=15969 Len=0
280,168.63.129.16,10.0.0.4,32526 → 49702 [ACK] Seq=26 Ack=647436 Win=15905 Len=0
281,10.0.0.4,168.63.129.16,49702 → 32526 [PSH\, ACK] Seq=663820 Ack=26 Win=2052 Len=8192
282,168.63.129.16,10.0.0.4,[TCP Window Update] 32526 → 49702 [ACK] Seq=26 Ack=647436 Win=15921 Len=0
283,168.63.129.16,10.0.0.4,[TCP Window Update] 32526 → 49702 [ACK] Seq=26 Ack=647436 Win=15937 Len=0
284,10.0.0.4,168.63.129.16,49702 → 32526 [PSH\, ACK] Seq=672012 Ack=26 Win=2052 Len=8192
285,168.63.129.16,10.0.0.4,32526 → 49702 [ACK] Seq=26 Ack=663820 Win=15873 Len=0
286,168.63.129.16,10.0.0.4,[TCP Window Update] 32526 → 49702 [ACK] Seq=26 Ack=663820 Win=15889 Len=0
287,10.0.0.4,168.63.129.16,49702 → 32526 [PSH\, ACK] Seq=680204 Ack=26 Win=2052 Len=8192
288,10.0.0.4,168.63.129.16,49702 → 32526 [PSH\, ACK] Seq=688396 Ack=26 Win=2052 Len=8192
289,10.0.0.4,168.63.129.16,49702 → 32526 [PSH\, ACK] Seq=696588 Ack=26 Win=2052 Len=8192
290,168.63.129.16,10.0.0.4,32526 → 49702 [ACK] Seq=26 Ack=672012 Win=15857 Len=0
291,168.63.129.16,10.0.0.4,[TCP Window Update] 32526 → 49702 [ACK] Seq=26 Ack=672012 Win=15873 Len=0
292,168.63.129.16,10.0.0.4,[TCP Window Update] 32526 → 49702 [ACK] Seq=26 Ack=672012 Win=15889 Len=0
293,168.63.129.16,10.0.0.4,32526 → 49702 [ACK] Seq=26 Ack=688396 Win=15825 Len=0
294,168.63.129.16,10.0.0.4,[TCP Window Update] 32526 → 49702 [ACK] Seq=26 Ack=688396 Win=15841 Len=0
295,10.0.0.4,168.63.129.16,49702 → 32526 [PSH\, ACK] Seq=704780 Ack=26 Win=2052 Len=8192
296,168.63.129.16,10.0.0.4,32526 → 49702 [ACK] Seq=26 Ack=704780 Win=15777 Len=0
297,168.63.129.16,10.0.0.4,[TCP Window Update] 32526 → 49702 [ACK] Seq=26 Ack=704780 Win=15793 Len=0
298,168.63.129.16,10.0.0.4,[TCP Window Update] 32526 → 49702 [ACK] Seq=26 Ack=704780 Win=15809 Len=0
299,10.0.0.4,168.63.129.16,49702 → 32526 [PSH\, ACK] Seq=712972 Ack=26 Win=2052 Len=8192
300,10.0.0.4,168.63.129.16,49702 → 32526 [PSH\, ACK] Seq=721164 Ack=26 Win=2052 Len=8192
301,168.63.129.16,10.0.0.4,32526 → 49702 [ACK] Seq=26 Ack=712972 Win=15793 Len=0
302,168.63.129.16,10.0.0.4,[TCP Window Update] 32526 → 49702 [ACK] Seq=26 Ack=712972 Win=15777 Len=0
303,10.0.0.4,168.63.129.16,49702 → 32526 [PSH\, ACK] Seq=729356 Ack=26 Win=2052 Len=8192
304,10.0.0.4,168.63.129.16,49702 → 32526 [PSH\, ACK] Seq=737548 Ack=26 Win=2052 Len=8192
305,168.63.129.16,10.0.0.4,32526 → 49702 [ACK] Seq=26 Ack=729356 Win=15729 Len=0
306,10.0.0.4,168.63.129.16,49702 → 32526 [PSH\, ACK] Seq=745740 Ack=26 Win=2052 Len=8192
307,10.0.0.4,168.63.129.16,49702 → 32526 [PSH\, ACK] Seq=753932 Ack=26 Win=2052 Len=8192
308,10.0.0.4,168.63.129.16,49702 → 32526 [PSH\, ACK] Seq=762124 Ack=26 Win=2052 Len=8192
309,168.63.129.16,10.0.0.4,[TCP Window Update] 32526 → 49702 [ACK] Seq=26 Ack=729356 Win=15745 Len=0
310,168.63.129.16,10.0.0.4,32526 → 49702 [ACK] Seq=26 Ack=737548 Win=15713 Len=0
311,168.63.129.16,10.0.0.4,32526 → 49702 [ACK] Seq=26 Ack=745740 Win=15681 Len=0
312,168.63.129.16,10.0.0.4,[TCP Window Update] 32526 → 49702 [ACK] Seq=26 Ack=745740 Win=15697 Len=0
313,10.0.0.4,168.63.129.16,49702 → 32526 [PSH\, ACK] Seq=770316 Ack=26 Win=2052 Len=8192
314,168.63.129.16,10.0.0.4,32526 → 49702 [ACK] Seq=26 Ack=762124 Win=15649 Len=0
315,168.63.129.16,10.0.0.4,32526 → 49702 [ACK] Seq=26 Ack=770316 Win=15617 Len=0
316,10.0.0.4,168.63.129.16,49702 → 32526 [PSH\, ACK] Seq=778508 Ack=26 Win=2052 Len=8192
317,10.0.0.4,168.63.129.16,49702 → 32526 [PSH\, ACK] Seq=786700 Ack=26 Win=2052 Len=8192
318,168.63.129.16,10.0.0.4,[TCP Window Update] 32526 → 49702 [ACK] Seq=26 Ack=770316 Win=15633 Len=0
319,168.63.129.16,10.0.0.4,32526 → 49702 [ACK] Seq=26 Ack=778508 Win=15601 Len=0
320,168.63.129.16,10.0.0.4,[TCP Window Update] 32526 → 49702 [ACK] Seq=26 Ack=778508 Win=15617 Len=0
321,168.63.129.16,10.0.0.4,32526 → 49702 [ACK] Seq=26 Ack=786700 Win=15585 Len=0
322,168.63.129.16,10.0.0.4,[TCP Window Update] 32526 → 49702 [ACK] Seq=26 Ack=786700 Win=15601 Len=0
323,10.0.0.4,168.63.129.16,49702 → 32526 [PSH\, ACK] Seq=794892 Ack=26 Win=2052 Len=8192
324,10.0.0.4,168.63.129.16,49702 → 32526 [PSH\, ACK] Seq=803084 Ack=26 Win=2052 Len=8192
325,10.0.0.4,168.63.129.16,49702 → 32526 [PSH\, ACK] Seq=811276 Ack=26 Win=2052 Len=8192
326,168.63.129.16,10.0.0.4,[TCP Window Update] 32526 → 49702 [ACK] Seq=26 Ack=786700 Win=15617 Len=0
327,168.63.129.16,10.0.0.4,32526 → 49702 [ACK] Seq=26 Ack=794892 Win=15585 Len=0
328,168.63.129.16,10.0.0.4,32526 → 49702 [ACK] Seq=26 Ack=811276 Win=15521 Len=0
329,168.63.129.16,10.0.0.4,[TCP Window Update] 32526 → 49702 [ACK] Seq=26 Ack=811276 Win=15537 Len=0
330,10.0.0.4,168.63.129.16,49702 → 32526 [PSH\, ACK] Seq=819468 Ack=26 Win=2052 Len=8192
331,10.0.0.4,168.63.129.16,49702 → 32526 [PSH\, ACK] Seq=827660 Ack=26 Win=2052 Len=8192
332,10.0.0.4,168.63.129.16,49702 → 32526 [PSH\, ACK] Seq=835852 Ack=26 Win=2052 Len=8192
333,168.63.129.16,10.0.0.4,32526 → 49702 [ACK] Seq=26 Ack=819468 Win=15521 Len=0
334,168.63.129.16,10.0.0.4,[TCP Window Update] 32526 → 49702 [ACK] Seq=26 Ack=819468 Win=15537 Len=0
335,10.0.0.4,168.63.129.16,49702 → 32526 [PSH\, ACK] Seq=844044 Ack=26 Win=2052 Len=8192
336,168.63.129.16,10.0.0.4,[TCP Window Update] 32526 → 49702 [ACK] Seq=26 Ack=819468 Win=15553 Len=0
337,168.63.129.16,10.0.0.4,[TCP Window Update] 32526 → 49702 [ACK] Seq=26 Ack=819468 Win=15569 Len=0
338,10.0.0.4,168.63.129.16,49702 → 32526 [PSH\, ACK] Seq=852236 Ack=26 Win=2052 Len=8192
339,10.0.0.4,168.63.129.16,49702 → 32526 [PSH\, ACK] Seq=860428 Ack=26 Win=2052 Len=8192
340,10.0.0.4,168.63.129.16,49702 → 32526 [PSH\, ACK] Seq=868620 Ack=26 Win=2052 Len=8192
341,10.0.0.4,168.63.129.16,49702 → 32526 [PSH\, ACK] Seq=876812 Ack=26 Win=2052 Len=8192
342,10.0.0.4,168.63.129.16,49702 → 32526 [PSH\, ACK] Seq=885004 Ack=26 Win=2052 Len=8192
343,10.0.0.4,168.63.129.16,49702 → 32526 [PSH\, ACK] Seq=893196 Ack=26 Win=2052 Len=8192
344,10.0.0.4,168.63.129.16,49702 → 32526 [PSH\, ACK] Seq=901388 Ack=26 Win=2052 Len=8192
345,10.0.0.4,168.63.129.16,49702 → 32526 [PSH\, ACK] Seq=909580 Ack=26 Win=2052 Len=8192
346,10.0.0.4,168.63.129.16,49702 → 32526 [PSH\, ACK] Seq=917772 Ack=26 Win=2052 Len=8192
347,10.0.0.4,168.63.129.16,49702 → 32526 [PSH\, ACK] Seq=925964 Ack=26 Win=2052 Len=8192
348,10.0.0.4,168.63.129.16,49702 → 32526 [PSH\, ACK] Seq=934156 Ack=26 Win=2052 Len=8192
349,10.0.0.4,168.63.129.16,49702 → 32526 [PSH\, ACK] Seq=942348 Ack=26 Win=2052 Len=8192
350,10.0.0.4,168.63.129.16,49702 → 32526 [PSH\, ACK] Seq=950540 Ack=26 Win=2052 Len=8192
351,168.63.129.16,10.0.0.4,32526 → 49702 [ACK] Seq=26 Ack=844044 Win=15473 Len=0
352,168.63.129.16,10.0.0.4,32526 → 49702 [ACK] Seq=26 Ack=860428 Win=15425 Len=0
353,168.63.129.16,10.0.0.4,32526 → 49702 [ACK] Seq=26 Ack=844044 Win=15489 Len=0
354,168.63.129.16,10.0.0.4,32526 → 49702 [ACK] Seq=26 Ack=885004 Win=15329 Len=0
355,168.63.129.16,10.0.0.4,[TCP Window Update] 32526 → 49702 [ACK] Seq=26 Ack=885004 Win=15345 Len=0
356,10.0.0.4,168.63.129.16,49702 → 32526 [PSH\, ACK] Seq=958732 Ack=26 Win=2052 Len=8192
357,168.63.129.16,10.0.0.4,32526 → 49702 [ACK] Seq=26 Ack=909580 Win=15249 Len=0
358,10.0.0.4,168.63.129.16,49702 → 32526 [PSH\, ACK] Seq=966924 Ack=26 Win=2052 Len=8192
359,168.63.129.16,10.0.0.4,32526 → 49702 [ACK] Seq=26 Ack=917772 Win=15217 Len=0
360,168.63.129.16,10.0.0.4,[TCP Window Update] 32526 → 49702 [ACK] Seq=26 Ack=917772 Win=15233 Len=0
361,168.63.129.16,10.0.0.4,32526 → 49702 [ACK] Seq=26 Ack=925964 Win=15201 Len=0
362,10.0.0.4,168.63.129.16,49702 → 32526 [PSH\, ACK] Seq=975116 Ack=26 Win=2052 Len=8192
363,168.63.129.16,10.0.0.4,[TCP Window Update] 32526 → 49702 [ACK] Seq=26 Ack=925964 Win=15217 Len=0
364,168.63.129.16,10.0.0.4,32526 → 49702 [ACK] Seq=26 Ack=942348 Win=15153 Len=0
365,168.63.129.16,10.0.0.4,[TCP Window Update] 32526 → 49702 [ACK] Seq=26 Ack=942348 Win=15169 Len=0
366,10.0.0.4,168.63.129.16,49702 → 32526 [PSH\, ACK] Seq=983308 Ack=26 Win=2052 Len=8192
367,168.63.129.16,10.0.0.4,32526 → 49702 [ACK] Seq=26 Ack=958732 Win=15121 Len=0
368,168.63.129.16,10.0.0.4,[TCP Window Update] 32526 → 49702 [ACK] Seq=26 Ack=958732 Win=15137 Len=0
369,168.63.129.16,10.0.0.4,[TCP Window Update] 32526 → 49702 [ACK] Seq=26 Ack=958732 Win=15153 Len=0
370,10.0.0.4,168.63.129.16,49702 → 32526 [PSH\, ACK] Seq=991500 Ack=26 Win=2052 Len=8192
371,10.0.0.4,168.63.129.16,49702 → 32526 [PSH\, ACK] Seq=999692 Ack=26 Win=2052 Len=8192
372,10.0.0.4,168.63.129.16,49702 → 32526 [PSH\, ACK] Seq=1007884 Ack=26 Win=2052 Len=8192
373,10.0.0.4,168.63.129.16,49702 → 32526 [PSH\, ACK] Seq=1016076 Ack=26 Win=2052 Len=8192
374,168.63.129.16,10.0.0.4,32526 → 49702 [ACK] Seq=26 Ack=966924 Win=15121 Len=0
375,10.0.0.4,168.63.129.16,49702 → 32526 [PSH\, ACK] Seq=1024268 Ack=26 Win=2052 Len=8192
376,10.0.0.4,168.63.129.16,49702 → 32526 [PSH\, ACK] Seq=1032460 Ack=26 Win=2052 Len=8192
377,168.63.129.16,10.0.0.4,32526 → 49702 [ACK] Seq=26 Ack=1007884 Win=14961 Len=0
378,10.0.0.4,168.63.129.16,49702 → 32526 [PSH\, ACK] Seq=1040652 Ack=26 Win=2052 Len=8192
379,10.0.0.4,168.63.129.16,49702 → 32526 [PSH\, ACK] Seq=1048844 Ack=26 Win=2052 Len=8192
380,10.0.0.4,168.63.129.16,49702 → 32526 [PSH\, ACK] Seq=1057036 Ack=26 Win=2052 Len=8192
381,10.0.0.4,168.63.129.16,49702 → 32526 [PSH\, ACK] Seq=1065228 Ack=26 Win=2052 Len=8192
382,10.0.0.4,168.63.129.16,49702 → 32526 [PSH\, ACK] Seq=1073420 Ack=26 Win=2052 Len=8192
383,10.0.0.4,168.63.129.16,49702 → 32526 [PSH\, ACK] Seq=1081612 Ack=26 Win=2052 Len=8192
384,10.0.0.4,168.63.129.16,49702 → 32526 [PSH\, ACK] Seq=1089804 Ack=26 Win=2052 Len=8192
385,10.0.0.4,168.63.129.16,49702 → 32526 [PSH\, ACK] Seq=1097996 Ack=26 Win=2052 Len=8192
386,10.0.0.4,168.63.129.16,49702 → 32526 [PSH\, ACK] Seq=1106188 Ack=26 Win=2052 Len=8192
387,10.0.0.4,168.63.129.16,49702 → 32526 [PSH\, ACK] Seq=1114380 Ack=26 Win=2052 Len=8192
388,10.0.0.4,168.63.129.16,49702 → 32526 [PSH\, ACK] Seq=1122572 Ack=26 Win=2052 Len=8192
389,168.63.129.16,10.0.0.4,32526 → 49702 [ACK] Seq=26 Ack=1048844 Win=14801 Len=0
390,10.0.0.4,168.63.129.16,49702 → 32526 [PSH\, ACK] Seq=1130764 Ack=26 Win=2052 Len=8192
391,168.63.129.16,10.0.0.4,32526 → 49702 [ACK] Seq=26 Ack=1073420 Win=14705 Len=0
392,168.63.129.16,10.0.0.4,32526 → 49702 [ACK] Seq=26 Ack=1089804 Win=14641 Len=0
393,10.0.0.4,168.63.129.16,49702 → 32526 [PSH\, ACK] Seq=1138956 Ack=26 Win=2052 Len=8192
394,168.63.129.16,10.0.0.4,32526 → 49702 [ACK] Seq=26 Ack=1106188 Win=14577 Len=0
395,10.0.0.4,168.63.129.16,49702 → 32526 [PSH\, ACK] Seq=1147148 Ack=26 Win=2052 Len=8192
396,168.63.129.16,10.0.0.4,32526 → 49702 [ACK] Seq=26 Ack=1122572 Win=14513 Len=0
397,168.63.129.16,10.0.0.4,32526 → 49702 [ACK] Seq=26 Ack=1130764 Win=14481 Len=0
398,10.0.0.4,168.63.129.16,49702 → 32526 [PSH\, ACK] Seq=1155340 Ack=26 Win=2052 Len=8192
399,168.63.129.16,10.0.0.4,32526 → 49702 [ACK] Seq=26 Ack=1147148 Win=14417 Len=0
400,10.0.0.4,168.63.129.16,49702 → 32526 [PSH\, ACK] Seq=1163532 Ack=26 Win=2052 Len=8192
401,10.0.0.4,168.63.129.16,49702 → 32526 [PSH\, ACK] Seq=1171724 Ack=26 Win=2052 Len=8192
402,10.0.0.4,168.63.129.16,49702 → 32526 [PSH\, ACK] Seq=1179916 Ack=26 Win=2052 Len=8192
403,10.0.0.4,168.63.129.16,49702 → 32526 [PSH\, ACK] Seq=1188108 Ack=26 Win=2052 Len=8192
404,168.63.129.16,10.0.0.4,32526 → 49702 [ACK] Seq=26 Ack=1163532 Win=14353 Len=0
405,10.0.0.4,168.63.129.16,49702 → 32526 [PSH\, ACK] Seq=1196300 Ack=26 Win=2052 Len=8192
406,168.63.129.16,10.0.0.4,32526 → 49702 [ACK] Seq=26 Ack=1179916 Win=14289 Len=0
407,10.0.0.4,168.63.129.16,49702 → 32526 [PSH\, ACK] Seq=1204492 Ack=26 Win=2052 Len=8192
408,10.0.0.4,168.63.129.16,49702 → 32526 [PSH\, ACK] Seq=1212684 Ack=26 Win=2052 Len=8192
409,10.0.0.4,168.63.129.16,49702 → 32526 [PSH\, ACK] Seq=1220876 Ack=26 Win=2052 Len=8192
410,10.0.0.4,168.63.129.16,49702 → 32526 [PSH\, ACK] Seq=1229068 Ack=26 Win=2052 Len=8192
411,10.0.0.4,168.63.129.16,49702 → 32526 [PSH\, ACK] Seq=1237260 Ack=26 Win=2052 Len=8192
412,10.0.0.4,168.63.129.16,49702 → 32526 [PSH\, ACK] Seq=1245452 Ack=26 Win=2052 Len=8192
413,168.63.129.16,10.0.0.4,32526 → 49702 [ACK] Seq=26 Ack=1196300 Win=14225 Len=0
414,168.63.129.16,10.0.0.4,32526 → 49702 [ACK] Seq=26 Ack=1220876 Win=14129 Len=0
415,10.0.0.4,168.63.129.16,49702 → 32526 [PSH\, ACK] Seq=1253644 Ack=26 Win=2052 Len=8192
416,10.0.0.4,168.63.129.16,49702 → 32526 [PSH\, ACK] Seq=1261836 Ack=26 Win=2052 Len=8192
417,168.63.129.16,10.0.0.4,32526 → 49702 [ACK] Seq=26 Ack=1253644 Win=14001 Len=0
418,168.63.129.16,10.0.0.4,[TCP Window Update] 32526 → 49702 [ACK] Seq=26 Ack=1253644 Win=14017 Len=0
419,10.0.0.4,168.63.129.16,49702 → 32526 [PSH\, ACK] Seq=1270028 Ack=26 Win=2052 Len=8192
420,168.63.129.16,10.0.0.4,32526 → 49702 [ACK] Seq=26 Ack=1270028 Win=13953 Len=0
421,10.0.0.4,168.63.129.16,49702 → 32526 [PSH\, ACK] Seq=1278220 Ack=26 Win=2052 Len=8192
422,10.0.0.4,168.63.129.16,49702 → 32526 [PSH\, ACK] Seq=1286412 Ack=26 Win=2052 Len=8192
423,10.0.0.4,168.63.129.16,49702 → 32526 [PSH\, ACK] Seq=1294604 Ack=26 Win=2052 Len=8192
424,10.0.0.4,168.63.129.16,49702 → 32526 [PSH\, ACK] Seq=1302796 Ack=26 Win=2052 Len=8192
425,10.0.0.4,168.63.129.16,49702 → 32526 [PSH\, ACK] Seq=1310988 Ack=26 Win=2052 Len=8192
426,168.63.129.16,10.0.0.4,32526 → 49702 [ACK] Seq=26 Ack=1278220 Win=13921 Len=0
427,168.63.129.16,10.0.0.4,[TCP Window Update] 32526 → 49702 [ACK] Seq=26 Ack=1278220 Win=13937 Len=0
428,168.63.129.16,10.0.0.4,32526 → 49702 [ACK] Seq=26 Ack=1302796 Win=13841 Len=0
429,168.63.129.16,10.0.0.4,32526 → 49702 [ACK] Seq=26 Ack=1319180 Win=13777 Len=0
430,10.0.0.4,168.63.129.16,49702 → 32526 [PSH\, ACK] Seq=1319180 Ack=26 Win=2052 Len=8192
431,168.63.129.16,10.0.0.4,[TCP Window Update] 32526 → 49702 [ACK] Seq=26 Ack=1319180 Win=13793 Len=0
432,10.0.0.4,168.63.129.16,49702 → 32526 [PSH\, ACK] Seq=1327372 Ack=26 Win=2052 Len=8192
433,10.0.0.4,168.63.129.16,49702 → 32526 [PSH\, ACK] Seq=1335564 Ack=26 Win=2052 Len=8192
434,10.0.0.4,168.63.129.16,49702 → 32526 [PSH\, ACK] Seq=1343756 Ack=26 Win=2052 Len=8192
435,10.0.0.4,168.63.129.16,49702 → 32526 [PSH\, ACK] Seq=1351948 Ack=26 Win=2052 Len=8192
436,10.0.0.4,168.63.129.16,49702 → 32526 [PSH\, ACK] Seq=1360140 Ack=26 Win=2052 Len=8192
437,10.0.0.4,168.63.129.16,49702 → 32526 [PSH\, ACK] Seq=1368332 Ack=26 Win=2052 Len=8192
438,10.0.0.4,168.63.129.16,49702 → 32526 [PSH\, ACK] Seq=1376524 Ack=26 Win=2052 Len=8192
439,10.0.0.4,168.63.129.16,49702 → 32526 [PSH\, ACK] Seq=1384716 Ack=26 Win=2052 Len=8192
440,10.0.0.4,168.63.129.16,49702 → 32526 [PSH\, ACK] Seq=1392908 Ack=26 Win=2052 Len=8192
441,168.63.129.16,10.0.0.4,32526 → 49702 [ACK] Seq=26 Ack=1327372 Win=13761 Len=0
