frame.number,ip.src,ip.dst,_ws.col.info
1,10.0.0.4,168.63.129.16,Standard query 0x57ee PTR 115.141.155.57.in-addr.arpa
2,168.63.129.16,10.0.0.4,Standard query response 0x57ee No such name PTR 115.141.155.57.in-addr.arpa SOA ns1-37.azure-dns.com
3,49.228.168.4,10.0.0.4,59415 → 3389 [ACK] Seq=1 Ack=1 Win=2048 Len=0
4,10.0.0.4,49.228.168.4,[TCP ACKed unseen segment] 3389 → 59415 [ACK] Seq=1 Ack=2 Win=63269 Len=0 TSval=82451 TSecr=4070334858
5,10.0.0.4,49.228.168.4,Application Data
6,49.228.168.4,10.0.0.4,[TCP Previous segment not captured] 59415 → 3389 [ACK] Seq=2 Ack=502 Win=2041 Len=0 TSval=4070335264 TSecr=82500
7,49.228.168.4,10.0.0.4,Application Data
8,49.228.168.4,10.0.0.4,Application Data
9,49.228.168.4,10.0.0.4,Application Data
10,49.228.168.4,10.0.0.4,Application Data
11,49.228.168.4,10.0.0.4,Application Data
12,10.0.0.4,49.228.168.4,3389 → 59415 [ACK] Seq=502 Ack=834 Win=64000 Len=0 TSval=82557 TSecr=4070335272
13,10.0.0.4,49.228.168.4,Application Data
14,10.0.0.4,49.228.168.4,Application Data
15,10.0.0.4,49.228.168.4,Application Data
16,10.0.0.4,49.228.168.4,Application Data
17,10.0.0.4,49.228.168.4,Application Data
18,10.0.0.4,49.228.168.4,Application Data
19,10.0.0.4,49.228.168.4,Application Data
20,10.0.0.4,49.228.168.4,Application Data
21,49.228.168.4,10.0.0.4,59415 → 3389 [ACK] Seq=834 Ack=1063 Win=2040 Len=0 TSval=4070335322 TSecr=82558
22,49.228.168.4,10.0.0.4,Application Data
23,49.228.168.4,10.0.0.4,Application Data
24,49.228.168.4,10.0.0.4,Application Data
25,10.0.0.4,49.228.168.4,3389 → 59415 [ACK] Seq=1063 Ack=1003 Win=63831 Len=0 TSval=82607 TSecr=4070335324
26,49.228.168.4,10.0.0.4,Application Data
27,10.0.0.4,49.228.168.4,3389 → 59415 [ACK] Seq=1063 Ack=1114 Win=63720 Len=0 TSval=82609 TSecr=4070335326
28,10.0.0.4,49.228.168.4,Application Data
29,10.0.0.4,49.228.168.4,Application Data
30,10.0.0.4,49.228.168.4,Application Data
31,10.0.0.4,49.228.168.4,Application Data
32,10.0.0.4,49.228.168.4,Application Data
33,49.228.168.4,10.0.0.4,59415 → 3389 [ACK] Seq=1114 Ack=1133 Win=2047 Len=0 TSval=4070335382 TSecr=82618
34,49.228.168.4,10.0.0.4,59415 → 3389 [ACK] Seq=1114 Ack=1427 Win=2048 Len=0 TSval=4070335385 TSecr=82622
35,49.228.168.4,10.0.0.4,59415 → 3389 [ACK] Seq=1114 Ack=1524 Win=2048 Len=0 TSval=4070335386 TSecr=82622
36,49.228.168.4,10.0.0.4,Application Data
37,49.228.168.4,10.0.0.4,Application Data
38,49.228.168.4,10.0.0.4,Application Data
39,49.228.168.4,10.0.0.4,Application Data
40,49.228.168.4,10.0.0.4,Application Data
41,10.0.0.4,49.228.168.4,3389 → 59415 [ACK] Seq=1524 Ack=1431 Win=63403 Len=0 TSval=82667 TSecr=4070335386
42,10.0.0.4,49.228.168.4,Application Data
43,49.228.168.4,10.0.0.4,59415 → 3389 [ACK] Seq=1431 Ack=1577 Win=2048 Len=0 TSval=4070335435 TSecr=82667
44,49.228.168.4,10.0.0.4,Application Data
45,10.0.0.4,49.228.168.4,3389 → 59415 [ACK] Seq=1577 Ack=1484 Win=63350 Len=0 TSval=82767 TSecr=4070335436
46,10.0.0.4,168.63.129.16,49731 → 80 [SYN\, ECE\, CWR] Seq=0 Win=64240 Len=0 MSS=1460 WS=256 SACK_PERM
47,168.63.129.16,10.0.0.4,80 → 49731 [SYN\, ACK\, ECE] Seq=0 Ack=1 Win=65535 Len=0 MSS=1460 WS=256 SACK_PERM
48,10.0.0.4,168.63.129.16,49731 → 80 [ACK] Seq=1 Ack=1 Win=4194560 Len=0
49,10.0.0.4,168.63.129.16,GET /machine?comp=goalstate HTTP/1.1 
50,168.63.129.16,10.0.0.4,HTTP/1.1 200 OK 
51,168.63.129.16,10.0.0.4,HTTP/1.1 200 OK 
52,10.0.0.4,168.63.129.16,49731 → 80 [ACK] Seq=157 Ack=2216 Win=4194560 Len=0
53,10.0.0.4,168.63.129.16,49731 → 80 [FIN\, ACK] Seq=157 Ack=2216 Win=4194560 Len=0
54,168.63.129.16,10.0.0.4,80 → 49731 [ACK] Seq=2216 Ack=158 Win=4194560 Len=0
55,10.0.0.4,168.63.129.16,PUT /status HTTP/1.1 
56,168.63.129.16,10.0.0.4,HTTP/1.1 100 Continue 
57,10.0.0.4,168.63.129.16,PUT /status HTTP/1.1 \, JSON (application/json)
58,168.63.129.16,10.0.0.4,32526 → 49677 [ACK] Seq=26 Ack=2327 Win=16385 Len=0
59,168.63.129.16,10.0.0.4,HTTP/1.1 200 OK 
60,10.0.0.4,168.63.129.16,49677 → 32526 [ACK] Seq=2327 Ack=161 Win=2048 Len=0
61,10.0.0.4,168.63.129.16,Standard query 0xbca1 PTR 4.168.228.49.in-addr.arpa
62,10.0.0.4,49.228.168.4,Application Data
63,49.228.168.4,10.0.0.4,59415 → 3389 [ACK] Seq=1484 Ack=1628 Win=2048 Len=0 TSval=4070336422 TSecr=83658
64,168.63.129.16,10.0.0.4,Standard query response 0xbca1 PTR 4.168.228.49.in-addr.arpa PTR 49-228-168-0.24.nat.tls1b-cgn02.myaisfibre.com
65,10.0.0.4,168.63.129.16,Standard query 0xf2ea A wpad.sjdack0qfdgetkhoz0ictmmdbd.ix.internal.cloudapp.net
66,168.63.129.16,10.0.0.4,Standard query response 0xf2ea No such name A wpad.sjdack0qfdgetkhoz0ictmmdbd.ix.internal.cloudapp.net SOA azureprivatedns.net
67,49.228.168.4,10.0.0.4,Application Data
68,49.228.168.4,10.0.0.4,59415 → 3389 [ACK] Seq=1483 Ack=1628 Win=2048 Len=0
69,10.0.0.4,49.228.168.4,3389 → 59415 [ACK] Seq=1628 Ack=1516 Win=63318 Len=0 TSval=84097 TSecr=4070336816
70,10.0.0.4,57.155.141.115,Application Data
71,10.0.0.4,57.155.141.115,Application Data
72,57.155.141.115,10.0.0.4,443 → 49730 [ACK] Seq=1 Ack=6872 Win=16385 Len=0
73,57.155.141.115,10.0.0.4,Application Data
74,10.0.0.4,57.155.141.115,49730 → 443 [ACK] Seq=6872 Ack=236 Win=2050 Len=0
75,10.0.0.4,49.228.168.4,Application Data
76,49.228.168.4,10.0.0.4,59415 → 3389 [ACK] Seq=1516 Ack=1679 Win=2048 Len=0 TSval=4070337437 TSecr=84674
77,10.0.0.4,49.228.168.4,Application Data
78,10.0.0.4,49.228.168.4,Application Data
79,10.0.0.4,49.228.168.4,Application Data
80,10.0.0.4,49.228.168.4,Application Data
81,49.228.168.4,10.0.0.4,59415 → 3389 [ACK] Seq=1516 Ack=2706 Win=2032 Len=0 TSval=4070337609 TSecr=84846
82,49.228.168.4,10.0.0.4,Application Data
83,10.0.0.4,49.228.168.4,3389 → 59415 [ACK] Seq=2706 Ack=1577 Win=63257 Len=0 TSval=84956 TSecr=4070337610
84,10.0.0.4,49.228.168.4,Application Data
85,10.0.0.4,49.228.168.4,Application Data
86,10.0.0.4,49.228.168.4,Application Data
87,10.0.0.4,49.228.168.4,Application Data
88,10.0.0.4,49.228.168.4,Application Data
89,10.0.0.4,49.228.168.4,Application Data
90,10.0.0.4,49.228.168.4,Application Data
91,10.0.0.4,49.228.168.4,Application Data
92,10.0.0.4,49.228.168.4,Application Data
93,10.0.0.4,49.228.168.4,Application Data
94,49.228.168.4,10.0.0.4,59415 → 3389 [ACK] Seq=1577 Ack=6433 Win=1990 Len=0 TSval=4070337798 TSecr=85013
95,49.228.168.4,10.0.0.4,[TCP Window Update] 59415 → 3389 [ACK] Seq=1577 Ack=6433 Win=2048 Len=0 TSval=4070337798 TSecr=85013
96,49.228.168.4,10.0.0.4,Application Data
97,49.228.168.4,10.0.0.4,Application Data
98,49.228.168.4,10.0.0.4,Application Data
99,49.228.168.4,10.0.0.4,Application Data
100,49.228.168.4,10.0.0.4,Application Data
101,10.0.0.4,49.228.168.4,3389 → 59415 [ACK] Seq=6433 Ack=1890 Win=62944 Len=0 TSval=85084 TSecr=4070337801
102,49.228.168.4,10.0.0.4,Application Data
103,10.0.0.4,49.228.168.4,3389 → 59415 [ACK] Seq=6433 Ack=1963 Win=62871 Len=0 TSval=85085 TSecr=4070337805
104,49.228.168.4,10.0.0.4,Application Data
105,10.0.0.4,49.228.168.4,Application Data
106,10.0.0.4,49.228.168.4,Application Data
107,10.0.0.4,49.228.168.4,Application Data
108,10.0.0.4,49.228.168.4,Application Data
109,49.228.168.4,10.0.0.4,59415 → 3389 [ACK] Seq=2036 Ack=7882 Win=2026 Len=0 TSval=4070337860 TSecr=85097
110,49.228.168.4,10.0.0.4,Application Data
111,10.0.0.4,49.228.168.4,Application Data
112,10.0.0.4,49.228.168.4,Application Data
113,10.0.0.4,49.228.168.4,Application Data
114,49.228.168.4,10.0.0.4,Application Data
115,49.228.168.4,10.0.0.4,Application Data
116,10.0.0.4,49.228.168.4,3389 → 59415 [ACK] Seq=9652 Ack=2183 Win=62651 Len=0 TSval=85176 TSecr=4070337887
117,49.228.168.4,10.0.0.4,Application Data
118,49.228.168.4,10.0.0.4,Application Data
119,49.228.168.4,10.0.0.4,59415 → 3389 [ACK] Seq=2269 Ack=7919 Win=2048 Len=0 TSval=4070337899 TSecr=85135
120,10.0.0.4,49.228.168.4,3389 → 59415 [ACK] Seq=9652 Ack=2269 Win=62565 Len=0 TSval=85180 TSecr=4070337895
121,49.228.168.4,10.0.0.4,Application Data
122,10.0.0.4,49.228.168.4,3389 → 59415 [ACK] Seq=9652 Ack=2312 Win=64000 Len=0 TSval=85182 TSecr=4070337901
123,49.228.168.4,10.0.0.4,Application Data
124,10.0.0.4,49.228.168.4,3389 → 59415 [ACK] Seq=9652 Ack=2355 Win=63957 Len=0 TSval=85186 TSecr=4070337906
125,49.228.168.4,10.0.0.4,59415 → 3389 [ACK] Seq=2355 Ack=9652 Win=2021 Len=0 TSval=4070337910 TSecr=85145
126,49.228.168.4,10.0.0.4,Application Data
127,49.228.168.4,10.0.0.4,Application Data
128,49.228.168.4,10.0.0.4,Application Data
129,49.228.168.4,10.0.0.4,Application Data
130,10.0.0.4,49.228.168.4,3389 → 59415 [ACK] Seq=9652 Ack=2597 Win=63715 Len=0 TSval=85194 TSecr=4070337910
131,49.228.168.4,10.0.0.4,Application Data
132,49.228.168.4,10.0.0.4,Application Data
133,10.0.0.4,49.228.168.4,3389 → 59415 [ACK] Seq=9652 Ack=2683 Win=63629 Len=0 TSval=85200 TSecr=4070337918
134,49.228.168.4,10.0.0.4,Application Data
135,49.228.168.4,10.0.0.4,Application Data
136,10.0.0.4,49.228.168.4,3389 → 59415 [ACK] Seq=9652 Ack=2769 Win=63543 Len=0 TSval=85207 TSecr=4070337922
137,49.228.168.4,10.0.0.4,Application Data
138,49.228.168.4,10.0.0.4,Application Data
139,10.0.0.4,49.228.168.4,3389 → 59415 [ACK] Seq=9652 Ack=2855 Win=63457 Len=0 TSval=85215 TSecr=4070337930
140,10.0.0.4,8.8.8.8,Echo (ping) request  id=0x0001\, seq=1/256\, ttl=128
141,8.8.8.8,10.0.0.4,Echo (ping) reply    id=0x0001\, seq=1/256\, ttl=115 (request in 140)
142,49.228.168.4,10.0.0.4,Application Data
143,49.228.168.4,10.0.0.4,Application Data
144,10.0.0.4,49.228.168.4,3389 → 59415 [ACK] Seq=9652 Ack=2941 Win=63371 Len=0 TSval=85224 TSecr=4070337939
145,49.228.168.4,10.0.0.4,Application Data
146,49.228.168.4,10.0.0.4,Application Data
147,10.0.0.4,49.228.168.4,3389 → 59415 [ACK] Seq=9652 Ack=3027 Win=63285 Len=0 TSval=85232 TSecr=4070337950
148,49.228.168.4,10.0.0.4,Application Data
149,10.0.0.4,49.228.168.4,Application Data
150,10.0.0.4,49.228.168.4,Application Data
151,10.0.0.4,49.228.168.4,Application Data
152,10.0.0.4,49.228.168.4,Application Data
153,10.0.0.4,49.228.168.4,Application Data
154,10.0.0.4,49.228.168.4,Application Data
155,10.0.0.4,49.228.168.4,Application Data
156,10.0.0.4,49.228.168.4,Application Data
157,10.0.0.4,49.228.168.4,Application Data
158,10.0.0.4,49.228.168.4,Application Data
159,10.0.0.4,49.228.168.4,Application Data
160,10.0.0.4,49.228.168.4,Application Data
161,10.0.0.4,49.228.168.4,Application Data
162,10.0.0.4,49.228.168.4,Application Data
163,49.228.168.4,10.0.0.4,Application Data
164,49.228.168.4,10.0.0.4,Application Data
165,10.0.0.4,49.228.168.4,3389 → 59415 [ACK] Seq=16274 Ack=3156 Win=63156 Len=0 TSval=85248 TSecr=4070337959
166,49.228.168.4,10.0.0.4,Application Data
167,49.228.168.4,10.0.0.4,Application Data
168,10.0.0.4,49.228.168.4,3389 → 59415 [ACK] Seq=16274 Ack=3242 Win=63070 Len=0 TSval=85253 TSecr=4070337968
169,49.228.168.4,10.0.0.4,Application Data
170,49.228.168.4,10.0.0.4,Application Data
171,10.0.0.4,49.228.168.4,3389 → 59415 [ACK] Seq=16274 Ack=3328 Win=62984 Len=0 TSval=85261 TSecr=4070337976
172,49.228.168.4,10.0.0.4,Application Data
173,49.228.168.4,10.0.0.4,Application Data
174,10.0.0.4,49.228.168.4,3389 → 59415 [ACK] Seq=16274 Ack=3414 Win=62898 Len=0 TSval=85270 TSecr=4070337985
175,49.228.168.4,10.0.0.4,Application Data
176,49.228.168.4,10.0.0.4,Application Data
177,10.0.0.4,49.228.168.4,3389 → 59415 [ACK] Seq=16274 Ack=3500 Win=62812 Len=0 TSval=85278 TSecr=4070337993
178,49.228.168.4,10.0.0.4,Application Data
179,49.228.168.4,10.0.0.4,Application Data
180,10.0.0.4,49.228.168.4,3389 → 59415 [ACK] Seq=16274 Ack=3586 Win=62726 Len=0 TSval=85286 TSecr=4070338001
181,49.228.168.4,10.0.0.4,Application Data
182,49.228.168.4,10.0.0.4,59415 → 3389 [ACK] Seq=3629 Ack=16274 Win=1945 Len=0 TSval=4070338012 TSecr=85246
183,49.228.168.4,10.0.0.4,[TCP Window Update] 59415 → 3389 [ACK] Seq=3629 Ack=16274 Win=2048 Len=0 TSval=4070338012 TSecr=85248
184,49.228.168.4,10.0.0.4,Application Data
185,10.0.0.4,49.228.168.4,3389 → 59415 [ACK] Seq=16274 Ack=3682 Win=62630 Len=0 TSval=85293 TSecr=4070338010
186,49.228.168.4,10.0.0.4,Application Data
187,49.228.168.4,10.0.0.4,Application Data
188,49.228.168.4,10.0.0.4,Application Data
189,10.0.0.4,49.228.168.4,3389 → 59415 [ACK] Seq=16274 Ack=3849 Win=64000 Len=0 TSval=85293 TSecr=4070338012
190,49.228.168.4,10.0.0.4,Application Data
191,49.228.168.4,10.0.0.4,Application Data
192,10.0.0.4,49.228.168.4,3389 → 59415 [ACK] Seq=16274 Ack=3945 Win=63904 Len=0 TSval=85294 TSecr=4070338013
193,49.228.168.4,10.0.0.4,Application Data
194,49.228.168.4,10.0.0.4,Application Data
195,49.228.168.4,10.0.0.4,Application Data
196,10.0.0.4,49.228.168.4,3389 → 59415 [ACK] Seq=16274 Ack=4152 Win=63697 Len=0 TSval=85296 TSecr=4070338015
197,49.228.168.4,10.0.0.4,Application Data
198,49.228.168.4,10.0.0.4,Application Data
199,10.0.0.4,49.228.168.4,3389 → 59415 [ACK] Seq=16274 Ack=4238 Win=63611 Len=0 TSval=85304 TSecr=4070338018
200,49.228.168.4,10.0.0.4,Application Data
201,10.0.0.4,49.228.168.4,Application Data
202,49.228.168.4,10.0.0.4,Application Data
203,49.228.168.4,10.0.0.4,Application Data
204,10.0.0.4,49.228.168.4,Application Data
205,10.0.0.4,49.228.168.4,Application Data\, Application Data
206,10.0.0.4,49.228.168.4,Application Data
207,10.0.0.4,49.228.168.4,Application Data
208,10.0.0.4,49.228.168.4,Application Data
209,10.0.0.4,49.228.168.4,Application Data
210,49.228.168.4,10.0.0.4,Application Data
211,49.228.168.4,10.0.0.4,Application Data
212,10.0.0.4,49.228.168.4,3389 → 59415 [ACK] Seq=19364 Ack=4453 Win=63396 Len=0 TSval=85317 TSecr=4070338039
213,49.228.168.4,10.0.0.4,Application Data
214,49.228.168.4,10.0.0.4,Application Data
215,10.0.0.4,49.228.168.4,3389 → 59415 [ACK] Seq=19364 Ack=4539 Win=63310 Len=0 TSval=85332 TSecr=4070338047
216,49.228.168.4,10.0.0.4,Application Data
217,49.228.168.4,10.0.0.4,Application Data
218,10.0.0.4,49.228.168.4,3389 → 59415 [ACK] Seq=19364 Ack=4625 Win=63224 Len=0 TSval=85340 TSecr=4070338055
219,49.228.168.4,10.0.0.4,Application Data
220,49.228.168.4,10.0.0.4,Application Data
221,10.0.0.4,49.228.168.4,3389 → 59415 [ACK] Seq=19364 Ack=4711 Win=63138 Len=0 TSval=85352 TSecr=4070338064
222,49.228.168.4,10.0.0.4,59415 → 3389 [ACK] Seq=4711 Ack=16545 Win=2044 Len=0 TSval=4070338072 TSecr=85304
223,49.228.168.4,10.0.0.4,Application Data
224,49.228.168.4,10.0.0.4,Application Data
225,49.228.168.4,10.0.0.4,Application Data
226,10.0.0.4,49.228.168.4,3389 → 59415 [ACK] Seq=19364 Ack=4900 Win=62949 Len=0 TSval=85354 TSecr=4070338072
227,49.228.168.4,10.0.0.4,Application Data
228,10.0.0.4,49.228.168.4,3389 → 59415 [ACK] Seq=19364 Ack=4943 Win=62906 Len=0 TSval=85357 TSecr=4070338076
229,10.0.0.4,49.228.168.4,Application Data
230,10.0.0.4,49.228.168.4,Application Data
231,49.228.168.4,10.0.0.4,Application Data
232,49.228.168.4,10.0.0.4,59415 → 3389 [ACK] Seq=4986 Ack=19364 Win=2004 Len=0 TSval=4070338080 TSecr=85315
233,49.228.168.4,10.0.0.4,Application Data
234,49.228.168.4,10.0.0.4,Application Data
235,49.228.168.4,10.0.0.4,Application Data
236,49.228.168.4,10.0.0.4,Application Data
237,49.228.168.4,10.0.0.4,Application Data
238,10.0.0.4,49.228.168.4,3389 → 59415 [ACK] Seq=19757 Ack=5303 Win=64000 Len=0 TSval=85363 TSecr=4070338080
239,10.0.0.4,49.228.168.4,Application Data
240,49.228.168.4,10.0.0.4,Application Data
241,49.228.168.4,10.0.0.4,Application Data
242,10.0.0.4,49.228.168.4,3389 → 59415 [ACK] Seq=19829 Ack=5389 Win=63914 Len=0 TSval=85370 TSecr=4070338085
243,49.228.168.4,10.0.0.4,Application Data
244,49.228.168.4,10.0.0.4,Application Data
245,10.0.0.4,49.228.168.4,3389 → 59415 [ACK] Seq=19829 Ack=5475 Win=63828 Len=0 TSval=85378 TSecr=4070338093
246,49.228.168.4,10.0.0.4,Application Data
247,49.228.168.4,10.0.0.4,Application Data
248,10.0.0.4,49.228.168.4,3389 → 59415 [ACK] Seq=19829 Ack=5561 Win=63742 Len=0 TSval=85386 TSecr=4070338101
249,49.228.168.4,10.0.0.4,Application Data
250,10.0.0.4,49.228.168.4,Application Data
251,49.228.168.4,10.0.0.4,Application Data
252,49.228.168.4,10.0.0.4,Application Data
253,10.0.0.4,49.228.168.4,3389 → 59415 [ACK] Seq=20118 Ack=5690 Win=63613 Len=0 TSval=85400 TSecr=4070338114
254,49.228.168.4,10.0.0.4,Application Data
255,49.228.168.4,10.0.0.4,59415 → 3389 [ACK] Seq=5733 Ack=19757 Win=2042 Len=0 TSval=4070338122 TSecr=85360
256,49.228.168.4,10.0.0.4,Application Data
257,49.228.168.4,10.0.0.4,Application Data
258,49.228.168.4,10.0.0.4,Application Data
259,10.0.0.4,49.228.168.4,3389 → 59415 [ACK] Seq=20118 Ack=5932 Win=63371 Len=0 TSval=85403 TSecr=4070338122
260,49.228.168.4,10.0.0.4,Application Data
261,49.228.168.4,10.0.0.4,59415 → 3389 [ACK] Seq=5975 Ack=19829 Win=2047 Len=0 TSval=4070338128 TSecr=85363
262,49.228.168.4,10.0.0.4,Application Data
263,10.0.0.4,49.228.168.4,3389 → 59415 [ACK] Seq=20118 Ack=6032 Win=63271 Len=0 TSval=85409 TSecr=4070338126
264,49.228.168.4,10.0.0.4,Application Data
265,49.228.168.4,10.0.0.4,Application Data
266,10.0.0.4,49.228.168.4,3389 → 59415 [ACK] Seq=20118 Ack=6118 Win=63185 Len=0 TSval=85416 TSecr=4070338130
267,49.228.168.4,10.0.0.4,Application Data
268,49.228.168.4,10.0.0.4,Application Data
269,10.0.0.4,49.228.168.4,3389 → 59415 [ACK] Seq=20118 Ack=6204 Win=63099 Len=0 TSval=85423 TSecr=4070338140
270,10.0.0.4,49.228.168.4,Application Data
271,49.228.168.4,10.0.0.4,Application Data
272,10.0.0.4,49.228.168.4,Application Data
273,49.228.168.4,10.0.0.4,Application Data
274,49.228.168.4,10.0.0.4,Application Data
275,10.0.0.4,49.228.168.4,3389 → 59415 [ACK] Seq=20450 Ack=6333 Win=62970 Len=0 TSval=85437 TSecr=4070338151
276,49.228.168.4,10.0.0.4,59415 → 3389 [ACK] Seq=6333 Ack=20118 Win=2044 Len=0 TSval=4070338158 TSecr=85394
277,49.228.168.4,10.0.0.4,Application Data
278,49.228.168.4,10.0.0.4,Application Data
279,10.0.0.4,49.228.168.4,3389 → 59415 [ACK] Seq=20450 Ack=6479 Win=62824 Len=0 TSval=85439 TSecr=4070338158
280,49.228.168.4,10.0.0.4,Application Data
281,49.228.168.4,10.0.0.4,Application Data
282,10.0.0.4,49.228.168.4,3389 → 59415 [ACK] Seq=20450 Ack=6565 Win=62738 Len=0 TSval=85444 TSecr=4070338160
283,49.228.168.4,10.0.0.4,Application Data
284,10.0.0.4,49.228.168.4,Application Data
285,10.0.0.4,49.228.168.4,Application Data
286,10.0.0.4,49.228.168.4,Application Data
287,49.228.168.4,10.0.0.4,Application Data
288,49.228.168.4,10.0.0.4,Application Data
289,10.0.0.4,49.228.168.4,3389 → 59415 [ACK] Seq=21117 Ack=6694 Win=62609 Len=0 TSval=85457 TSecr=4070338172
290,49.228.168.4,10.0.0.4,Application Data
291,49.228.168.4,10.0.0.4,Application Data
292,10.0.0.4,49.228.168.4,3389 → 59415 [ACK] Seq=21117 Ack=6780 Win=64000 Len=0 TSval=85466 TSecr=4070338181
293,49.228.168.4,10.0.0.4,Application Data
294,10.0.0.4,49.228.168.4,Application Data
295,49.228.168.4,10.0.0.4,59415 → 3389 [ACK] Seq=6823 Ack=20387 Win=2044 Len=0 TSval=4070338190 TSecr=85426
296,49.228.168.4,10.0.0.4,Application Data
297,49.228.168.4,10.0.0.4,Application Data
298,10.0.0.4,49.228.168.4,3389 → 59415 [ACK] Seq=21546 Ack=6969 Win=63811 Len=0 TSval=85472 TSecr=4070338190
299,49.228.168.4,10.0.0.4,59415 → 3389 [ACK] Seq=6969 Ack=20450 Win=2048 Len=0 TSval=4070338192 TSecr=85426
300,49.228.168.4,10.0.0.4,Application Data
301,49.228.168.4,10.0.0.4,Application Data
302,49.228.168.4,10.0.0.4,Application Data
303,10.0.0.4,49.228.168.4,3389 → 59415 [ACK] Seq=21546 Ack=7148 Win=63632 Len=0 TSval=85475 TSecr=4070338193
304,10.0.0.4,49.228.168.4,Application Data
305,10.0.0.4,49.228.168.4,Application Data
306,49.228.168.4,10.0.0.4,Application Data
307,49.228.168.4,10.0.0.4,Application Data
308,10.0.0.4,49.228.168.4,3389 → 59415 [ACK] Seq=21712 Ack=7234 Win=63546 Len=0 TSval=85482 TSecr=4070338198
309,49.228.168.4,10.0.0.4,Application Data
310,49.228.168.4,10.0.0.4,Application Data
311,10.0.0.4,49.228.168.4,3389 → 59415 [ACK] Seq=21712 Ack=7320 Win=63460 Len=0 TSval=85491 TSecr=4070338206
312,49.228.168.4,10.0.0.4,Application Data
313,49.228.168.4,10.0.0.4,59415 → 3389 [ACK] Seq=7363 Ack=21117 Win=2038 Len=0 TSval=4070338217 TSecr=85453
314,49.228.168.4,10.0.0.4,Application Data
315,49.228.168.4,10.0.0.4,Application Data
316,49.228.168.4,10.0.0.4,Application Data
317,49.228.168.4,10.0.0.4,Application Data
318,10.0.0.4,49.228.168.4,3389 → 59415 [ACK] Seq=21712 Ack=7605 Win=63175 Len=0 TSval=85499 TSecr=4070338214
319,10.0.0.4,49.228.168.4,Application Data
320,49.228.168.4,10.0.0.4,Application Data
321,49.228.168.4,10.0.0.4,Application Data
322,10.0.0.4,49.228.168.4,3389 → 59415 [ACK] Seq=22253 Ack=7691 Win=63089 Len=0 TSval=85507 TSecr=4070338223
323,10.0.0.4,49.228.168.4,Application Data
324,10.0.0.4,49.228.168.4,Application Data
325,10.0.0.4,49.228.168.4,Application Data
326,10.0.0.4,49.228.168.4,Application Data
327,10.0.0.4,49.228.168.4,Application Data
328,10.0.0.4,49.228.168.4,Application Data
329,10.0.0.4,49.228.168.4,Application Data
330,10.0.0.4,49.228.168.4,Application Data
331,49.228.168.4,10.0.0.4,Application Data
332,49.228.168.4,10.0.0.4,Application Data
333,49.228.168.4,10.0.0.4,Application Data
334,49.228.168.4,10.0.0.4,Application Data
335,49.228.168.4,10.0.0.4,Application Data
336,49.228.168.4,10.0.0.4,Application Data
337,49.228.168.4,10.0.0.4,Application Data
338,49.228.168.4,10.0.0.4,Application Data
339,49.228.168.4,10.0.0.4,Application Data
340,49.228.168.4,10.0.0.4,Application Data
341,49.228.168.4,10.0.0.4,Application Data
342,49.228.168.4,10.0.0.4,Application Data
343,49.228.168.4,10.0.0.4,Application Data
344,49.228.168.4,10.0.0.4,Application Data
345,10.0.0.4,49.228.168.4,3389 → 59415 [ACK] Seq=26041 Ack=8293 Win=64000 Len=0 TSval=85597 TSecr=4070338230
346,49.228.168.4,10.0.0.4,Application Data
347,49.228.168.4,10.0.0.4,Application Data
348,49.228.168.4,10.0.0.4,Application Data
349,49.228.168.4,10.0.0.4,Application Data
350,49.228.168.4,10.0.0.4,Application Data
351,49.228.168.4,10.0.0.4,Application Data
352,49.228.168.4,10.0.0.4,Application Data
353,10.0.0.4,49.228.168.4,3389 → 59415 [ACK] Seq=26041 Ack=8594 Win=63699 Len=0 TSval=85598 TSecr=4070338289
354,49.228.168.4,10.0.0.4,Application Data
355,10.0.0.4,49.228.168.4,3389 → 59415 [ACK] Seq=26041 Ack=8637 Win=63656 Len=0 TSval=85599 TSecr=4070338318
356,49.228.168.4,10.0.0.4,59415 → 3389 [ACK] Seq=8637 Ack=21546 Win=2042 Len=0 TSval=4070338320 TSecr=85470
357,49.228.168.4,10.0.0.4,59415 → 3389 [ACK] Seq=8637 Ack=21712 Win=2046 Len=0 TSval=4070338320 TSecr=85476
358,49.228.168.4,10.0.0.4,59415 → 3389 [ACK] Seq=8637 Ack=26041 Win=1981 Len=0 TSval=4070338320 TSecr=85502
359,49.228.168.4,10.0.0.4,[TCP Window Update] 59415 → 3389 [ACK] Seq=8637 Ack=26041 Win=2048 Len=0 TSval=4070338320 TSecr=85502
360,49.228.168.4,10.0.0.4,Application Data
361,49.228.168.4,10.0.0.4,Application Data
362,49.228.168.4,10.0.0.4,Application Data
363,10.0.0.4,49.228.168.4,3389 → 59415 [ACK] Seq=26041 Ack=8875 Win=63418 Len=0 TSval=85602 TSecr=4070338320
364,49.228.168.4,10.0.0.4,Application Data
365,49.228.168.4,10.0.0.4,Application Data
366,49.228.168.4,10.0.0.4,Application Data
367,49.228.168.4,10.0.0.4,Application Data
368,49.228.168.4,10.0.0.4,Application Data
369,10.0.0.4,49.228.168.4,3389 → 59415 [ACK] Seq=26041 Ack=9212 Win=63081 Len=0 TSval=85602 TSecr=4070338320
370,10.0.0.4,49.228.168.4,Application Data
371,49.228.168.4,10.0.0.4,Application Data
372,49.228.168.4,10.0.0.4,Application Data
373,49.228.168.4,10.0.0.4,Application Data
374,49.228.168.4,10.0.0.4,Application Data
375,10.0.0.4,49.228.168.4,3389 → 59415 [ACK] Seq=26104 Ack=9462 Win=62831 Len=0 TSval=85603 TSecr=4070338322
376,49.228.168.4,10.0.0.4,Application Data
377,49.228.168.4,10.0.0.4,Application Data
378,10.0.0.4,49.228.168.4,3389 → 59415 [ACK] Seq=26104 Ack=9548 Win=62745 Len=0 TSval=85611 TSecr=4070338326
379,49.228.168.4,10.0.0.4,59415 → 3389 [ACK] Seq=9548 Ack=26104 Win=2048 Len=0 TSval=4070338365 TSecr=85602
380,49.228.168.4,10.0.0.4,Application Data
381,49.228.168.4,10.0.0.4,Application Data
382,10.0.0.4,49.228.168.4,3389 → 59415 [ACK] Seq=26104 Ack=9634 Win=62659 Len=0 TSval=85937 TSecr=4070338653
383,49.228.168.4,10.0.0.4,Application Data
384,49.228.168.4,10.0.0.4,Application Data
385,10.0.0.4,49.228.168.4,3389 → 59415 [ACK] Seq=26104 Ack=9720 Win=62573 Len=0 TSval=85954 TSecr=4070338669
386,49.228.168.4,10.0.0.4,Application Data
387,49.228.168.4,10.0.0.4,Application Data
388,10.0.0.4,49.228.168.4,3389 → 59415 [ACK] Seq=26104 Ack=9806 Win=64000 Len=0 TSval=85964 TSecr=4070338681
389,49.228.168.4,10.0.0.4,Application Data
390,49.228.168.4,10.0.0.4,Application Data
391,10.0.0.4,49.228.168.4,3389 → 59415 [ACK] Seq=26104 Ack=9892 Win=63914 Len=0 TSval=85972 TSecr=4070338685
392,49.228.168.4,10.0.0.4,Application Data
393,49.228.168.4,10.0.0.4,Application Data
394,10.0.0.4,49.228.168.4,3389 → 59415 [ACK] Seq=26104 Ack=9978 Win=63828 Len=0 TSval=85981 TSecr=4070338694
395,49.228.168.4,10.0.0.4,Application Data
396,49.228.168.4,10.0.0.4,Application Data
397,10.0.0.4,49.228.168.4,3389 → 59415 [ACK] Seq=26104 Ack=10064 Win=63742 Len=0 TSval=85989 TSecr=4070338702
398,49.228.168.4,10.0.0.4,Application Data
399,49.228.168.4,10.0.0.4,Application Data
400,10.0.0.4,49.228.168.4,3389 → 59415 [ACK] Seq=26104 Ack=10150 Win=63656 Len=0 TSval=85997 TSecr=4070338710
401,49.228.168.4,10.0.0.4,Application Data
402,49.228.168.4,10.0.0.4,Application Data
403,10.0.0.4,49.228.168.4,3389 → 59415 [ACK] Seq=26104 Ack=10236 Win=63570 Len=0 TSval=86006 TSecr=4070338719
404,49.228.168.4,10.0.0.4,Application Data
405,49.228.168.4,10.0.0.4,Application Data
406,10.0.0.4,49.228.168.4,3389 → 59415 [ACK] Seq=26104 Ack=10322 Win=63484 Len=0 TSval=86015 TSecr=4070338727
407,49.228.168.4,10.0.0.4,Application Data
408,49.228.168.4,10.0.0.4,Application Data
409,10.0.0.4,49.228.168.4,3389 → 59415 [ACK] Seq=26104 Ack=10408 Win=63398 Len=0 TSval=86022 TSecr=4070338735
410,49.228.168.4,10.0.0.4,Application Data
411,49.228.168.4,10.0.0.4,Application Data
412,10.0.0.4,49.228.168.4,3389 → 59415 [ACK] Seq=26104 Ack=10494 Win=63312 Len=0 TSval=86031 TSecr=4070338744
413,49.228.168.4,10.0.0.4,Application Data
414,49.228.168.4,10.0.0.4,Application Data
415,49.228.168.4,10.0.0.4,Application Data
416,49.228.168.4,10.0.0.4,Application Data
417,49.228.168.4,10.0.0.4,Application Data
418,49.228.168.4,10.0.0.4,Application Data
419,49.228.168.4,10.0.0.4,Application Data
420,49.228.168.4,10.0.0.4,Application Data
421,10.0.0.4,49.228.168.4,3389 → 59415 [ACK] Seq=26104 Ack=10838 Win=62968 Len=0 TSval=86122 TSecr=4070338752
422,49.228.168.4,10.0.0.4,Application Data
423,49.228.168.4,10.0.0.4,Application Data
424,10.0.0.4,49.228.168.4,3389 → 59415 [ACK] Seq=26104 Ack=10924 Win=62882 Len=0 TSval=86122 TSecr=4070338785
425,49.228.168.4,10.0.0.4,Application Data
426,49.228.168.4,10.0.0.4,Application Data
427,49.228.168.4,10.0.0.4,Application Data
428,49.228.168.4,10.0.0.4,Application Data
429,49.228.168.4,10.0.0.4,Application Data
430,49.228.168.4,10.0.0.4,Application Data
431,49.228.168.4,10.0.0.4,Application Data
432,49.228.168.4,10.0.0.4,Application Data
433,49.228.168.4,10.0.0.4,Application Data
434,49.228.168.4,10.0.0.4,Application Data
435,49.228.168.4,10.0.0.4,Application Data
436,49.228.168.4,10.0.0.4,Application Data
437,10.0.0.4,49.228.168.4,3389 → 59415 [ACK] Seq=26104 Ack=11440 Win=64000 Len=0 TSval=86123 TSecr=4070338793
438,49.228.168.4,10.0.0.4,Application Data
439,49.228.168.4,10.0.0.4,Application Data
440,10.0.0.4,49.228.168.4,3389 → 59415 [ACK] Seq=26104 Ack=11526 Win=63914 Len=0 TSval=86130 TSecr=4070338843
441,49.228.168.4,10.0.0.4,Application Data
442,49.228.168.4,10.0.0.4,Application Data
443,10.0.0.4,49.228.168.4,3389 → 59415 [ACK] Seq=26104 Ack=11612 Win=63828 Len=0 TSval=86136 TSecr=4070338851
444,49.228.168.4,10.0.0.4,Application Data
445,49.228.168.4,10.0.0.4,Application Data
446,10.0.0.4,49.228.168.4,3389 → 59415 [ACK] Seq=26104 Ack=11698 Win=63742 Len=0 TSval=86145 TSecr=4070338860
447,49.228.168.4,10.0.0.4,Application Data
448,49.228.168.4,10.0.0.4,Application Data
449,10.0.0.4,49.228.168.4,3389 → 59415 [ACK] Seq=26104 Ack=11784 Win=63656 Len=0 TSval=86155 TSecr=4070338868
450,49.228.168.4,10.0.0.4,Application Data
451,49.228.168.4,10.0.0.4,Application Data
452,10.0.0.4,49.228.168.4,3389 → 59415 [ACK] Seq=26104 Ack=11870 Win=63570 Len=0 TSval=86162 TSecr=4070338876
453,49.228.168.4,10.0.0.4,Application Data
454,49.228.168.4,10.0.0.4,Application Data
455,10.0.0.4,49.228.168.4,3389 → 59415 [ACK] Seq=26104 Ack=11956 Win=63484 Len=0 TSval=86169 TSecr=4070338885
456,49.228.168.4,10.0.0.4,Application Data
457,49.228.168.4,10.0.0.4,Application Data
458,10.0.0.4,49.228.168.4,3389 → 59415 [ACK] Seq=26104 Ack=12042 Win=63398 Len=0 TSval=86178 TSecr=4070338893
459,49.228.168.4,10.0.0.4,Application Data
460,49.228.168.4,10.0.0.4,Application Data
461,10.0.0.4,49.228.168.4,3389 → 59415 [ACK] Seq=26104 Ack=12128 Win=63312 Len=0 TSval=86186 TSecr=4070338901
462,49.228.168.4,10.0.0.4,Application Data
463,49.228.168.4,10.0.0.4,Application Data
464,10.0.0.4,49.228.168.4,3389 → 59415 [ACK] Seq=26104 Ack=12214 Win=63226 Len=0 TSval=86195 TSecr=4070338910
465,49.228.168.4,10.0.0.4,Application Data
466,49.228.168.4,10.0.0.4,Application Data
467,10.0.0.4,49.228.168.4,3389 → 59415 [ACK] Seq=26104 Ack=12300 Win=63140 Len=0 TSval=86203 TSecr=4070338918
468,49.228.168.4,10.0.0.4,Application Data
469,49.228.168.4,10.0.0.4,Application Data
470,10.0.0.4,49.228.168.4,3389 → 59415 [ACK] Seq=26104 Ack=12386 Win=63054 Len=0 TSval=86213 TSecr=4070338926
471,49.228.168.4,10.0.0.4,Application Data
472,49.228.168.4,10.0.0.4,Application Data
473,10.0.0.4,49.228.168.4,3389 → 59415 [ACK] Seq=26104 Ack=12472 Win=62968 Len=0 TSval=86219 TSecr=4070338935
474,49.228.168.4,10.0.0.4,Application Data
475,49.228.168.4,10.0.0.4,Application Data
476,10.0.0.4,49.228.168.4,3389 → 59415 [ACK] Seq=26104 Ack=12558 Win=62882 Len=0 TSval=86228 TSecr=4070338943
477,49.228.168.4,10.0.0.4,Application Data
478,49.228.168.4,10.0.0.4,Application Data
479,10.0.0.4,49.228.168.4,3389 → 59415 [ACK] Seq=26104 Ack=12644 Win=62796 Len=0 TSval=86236 TSecr=4070338951
480,49.228.168.4,10.0.0.4,Application Data
481,49.228.168.4,10.0.0.4,Application Data
482,10.0.0.4,49.228.168.4,3389 → 59415 [ACK] Seq=26104 Ack=12730 Win=62710 Len=0 TSval=86244 TSecr=4070338960
483,49.228.168.4,10.0.0.4,Application Data
484,49.228.168.4,10.0.0.4,Application Data
485,10.0.0.4,49.228.168.4,3389 → 59415 [ACK] Seq=26104 Ack=12816 Win=62624 Len=0 TSval=86253 TSecr=4070338968
486,49.228.168.4,10.0.0.4,Application Data
487,49.228.168.4,10.0.0.4,Application Data
488,10.0.0.4,49.228.168.4,3389 → 59415 [ACK] Seq=26104 Ack=12902 Win=64000 Len=0 TSval=86262 TSecr=4070338976
489,49.228.168.4,10.0.0.4,Application Data
490,49.228.168.4,10.0.0.4,Application Data
491,10.0.0.4,49.228.168.4,3389 → 59415 [ACK] Seq=26104 Ack=12988 Win=63914 Len=0 TSval=86268 TSecr=4070338985
492,10.0.0.4,49.228.168.4,Application Data
493,10.0.0.4,49.228.168.4,Application Data
494,10.0.0.4,49.228.168.4,Application Data
495,10.0.0.4,49.228.168.4,Application Data
496,49.228.168.4,10.0.0.4,Application Data
497,49.228.168.4,10.0.0.4,Application Data
498,10.0.0.4,49.228.168.4,3389 → 59415 [ACK] Seq=27448 Ack=13074 Win=63828 Len=0 TSval=86278 TSecr=4070338993
499,49.228.168.4,10.0.0.4,Application Data
500,10.0.0.4,49.228.168.4,Application Data
501,49.228.168.4,10.0.0.4,Application Data
502,10.0.0.4,49.228.168.4,Application Data
503,10.0.0.4,49.228.168.4,Application Data\, Application Data\, Application Data\, Application Data
504,49.228.168.4,10.0.0.4,Application Data
505,49.228.168.4,10.0.0.4,Application Data
506,10.0.0.4,49.228.168.4,3389 → 59415 [ACK] Seq=30964 Ack=13246 Win=63656 Len=0 TSval=86294 TSecr=4070339010
507,49.228.168.4,10.0.0.4,Application Data
508,49.228.168.4,10.0.0.4,Application Data
509,10.0.0.4,49.228.168.4,3389 → 59415 [ACK] Seq=30964 Ack=13332 Win=63570 Len=0 TSval=86304 TSecr=4070339018
510,49.228.168.4,10.0.0.4,Application Data
511,49.228.168.4,10.0.0.4,Application Data
512,10.0.0.4,49.228.168.4,3389 → 59415 [ACK] Seq=30964 Ack=13418 Win=63484 Len=0 TSval=86312 TSecr=4070339026
513,49.228.168.4,10.0.0.4,Application Data
514,49.228.168.4,10.0.0.4,59415 → 3389 [ACK] Seq=13461 Ack=27448 Win=2048 Len=0 TSval=4070339037 TSecr=86271
515,49.228.168.4,10.0.0.4,Application Data
516,10.0.0.4,49.228.168.4,3389 → 59415 [ACK] Seq=30964 Ack=13514 Win=63388 Len=0 TSval=86319 TSecr=4070339035
517,49.228.168.4,10.0.0.4,Application Data
518,49.228.168.4,10.0.0.4,Application Data
519,10.0.0.4,49.228.168.4,3389 → 59415 [ACK] Seq=30964 Ack=13600 Win=63302 Len=0 TSval=86324 TSecr=4070339039
520,10.0.0.4,49.228.168.4,Application Data
521,10.0.0.4,49.228.168.4,Application Data
522,10.0.0.4,49.228.168.4,Application Data
523,10.0.0.4,49.228.168.4,Application Data
524,10.0.0.4,49.228.168.4,Application Data
525,49.228.168.4,10.0.0.4,Application Data
526,49.228.168.4,10.0.0.4,Application Data
527,10.0.0.4,49.228.168.4,3389 → 59415 [ACK] Seq=32836 Ack=13686 Win=63216 Len=0 TSval=86332 TSecr=4070339047
528,49.228.168.4,10.0.0.4,59415 → 3389 [ACK] Seq=13686 Ack=27554 Win=2047 Len=0 TSval=4070339051 TSecr=86287
529,49.228.168.4,10.0.0.4,59415 → 3389 [ACK] Seq=13686 Ack=30964 Win=2048 Len=0 TSval=4070339052 TSecr=86287
530,49.228.168.4,10.0.0.4,Application Data
531,49.228.168.4,10.0.0.4,Application Data
532,49.228.168.4,10.0.0.4,Application Data
533,10.0.0.4,49.228.168.4,3389 → 59415 [ACK] Seq=32836 Ack=13853 Win=63049 Len=0 TSval=86333 TSecr=4070339052
534,49.228.168.4,10.0.0.4,Application Data
535,10.0.0.4,49.228.168.4,3389 → 59415 [ACK] Seq=32836 Ack=13896 Win=63006 Len=0 TSval=86337 TSecr=4070339056
536,49.228.168.4,10.0.0.4,Application Data
537,10.0.0.4,49.228.168.4,Application Data
538,10.0.0.4,49.228.168.4,Application Data
539,10.0.0.4,49.228.168.4,Application Data
540,10.0.0.4,49.228.168.4,Application Data
541,10.0.0.4,49.228.168.4,Application Data
542,10.0.0.4,49.228.168.4,Application Data
543,49.228.168.4,10.0.0.4,Application Data
544,49.228.168.4,10.0.0.4,Application Data
545,10.0.0.4,49.228.168.4,3389 → 59415 [ACK] Seq=36352 Ack=14025 Win=62877 Len=0 TSval=86349 TSecr=4070339064
546,49.228.168.4,10.0.0.4,Application Data
547,49.228.168.4,10.0.0.4,Application Data
548,10.0.0.4,49.228.168.4,3389 → 59415 [ACK] Seq=36352 Ack=14111 Win=62791 Len=0 TSval=86360 TSecr=4070339072
549,49.228.168.4,10.0.0.4,Application Data
550,49.228.168.4,10.0.0.4,Application Data
551,10.0.0.4,49.228.168.4,3389 → 59415 [ACK] Seq=36352 Ack=14197 Win=62705 Len=0 TSval=86367 TSecr=4070339081
552,49.228.168.4,10.0.0.4,Application Data
553,49.228.168.4,10.0.0.4,59415 → 3389 [ACK] Seq=14240 Ack=32836 Win=2019 Len=0 TSval=4070339093 TSecr=86328
554,49.228.168.4,10.0.0.4,Application Data
555,10.0.0.4,49.228.168.4,3389 → 59415 [ACK] Seq=36352 Ack=14283 Win=62619 Len=0 TSval=86374 TSecr=4070339089
556,49.228.168.4,10.0.0.4,Application Data
557,49.228.168.4,10.0.0.4,Application Data
558,10.0.0.4,49.228.168.4,3389 → 59415 [ACK] Seq=36352 Ack=14397 Win=64000 Len=0 TSval=86375 TSecr=4070339093
559,49.228.168.4,10.0.0.4,Application Data
560,49.228.168.4,10.0.0.4,Application Data
561,10.0.0.4,49.228.168.4,3389 → 59415 [ACK] Seq=36352 Ack=14483 Win=63914 Len=0 TSval=86382 TSecr=4070339097
562,49.228.168.4,10.0.0.4,Application Data
563,49.228.168.4,10.0.0.4,59415 → 3389 [ACK] Seq=14526 Ack=36352 Win=1994 Len=0 TSval=4070339108 TSecr=86343
564,49.228.168.4,10.0.0.4,[TCP Window Update] 59415 → 3389 [ACK] Seq=14526 Ack=36352 Win=2048 Len=0 TSval=4070339109 TSecr=86343
565,49.228.168.4,10.0.0.4,Application Data
566,49.228.168.4,10.0.0.4,Application Data
567,49.228.168.4,10.0.0.4,Application Data
568,49.228.168.4,10.0.0.4,Application Data
569,10.0.0.4,49.228.168.4,3389 → 59415 [ACK] Seq=36352 Ack=14736 Win=63661 Len=0 TSval=86390 TSecr=4070339105
570,10.0.0.4,49.228.168.4,Application Data
571,10.0.0.4,49.228.168.4,Application Data
572,10.0.0.4,49.228.168.4,Application Data
573,10.0.0.4,49.228.168.4,Application Data
574,10.0.0.4,49.228.168.4,Application Data
575,10.0.0.4,49.228.168.4,Application Data
576,10.0.0.4,49.228.168.4,Application Data
577,10.0.0.4,49.228.168.4,Application Data
578,10.0.0.4,49.228.168.4,Application Data
579,49.228.168.4,10.0.0.4,Application Data
580,49.228.168.4,10.0.0.4,Application Data
581,10.0.0.4,49.228.168.4,3389 → 59415 [ACK] Seq=41634 Ack=14822 Win=63575 Len=0 TSval=86399 TSecr=4070339114
582,49.228.168.4,10.0.0.4,Application Data
583,49.228.168.4,10.0.0.4,Application Data
584,10.0.0.4,49.228.168.4,3389 → 59415 [ACK] Seq=41634 Ack=14908 Win=63489 Len=0 TSval=86407 TSecr=4070339122
585,49.228.168.4,10.0.0.4,Application Data
586,49.228.168.4,10.0.0.4,Application Data
587,10.0.0.4,49.228.168.4,3389 → 59415 [ACK] Seq=41634 Ack=14994 Win=63403 Len=0 TSval=86415 TSecr=4070339130
588,49.228.168.4,10.0.0.4,Application Data
589,49.228.168.4,10.0.0.4,Application Data
590,10.0.0.4,49.228.168.4,3389 → 59415 [ACK] Seq=41634 Ack=15080 Win=63317 Len=0 TSval=86424 TSecr=4070339139
591,49.228.168.4,10.0.0.4,Application Data
592,49.228.168.4,10.0.0.4,Application Data
593,10.0.0.4,49.228.168.4,3389 → 59415 [ACK] Seq=41634 Ack=15166 Win=63231 Len=0 TSval=86432 TSecr=4070339147
594,49.228.168.4,10.0.0.4,Application Data
595,49.228.168.4,10.0.0.4,59415 → 3389 [ACK] Seq=15209 Ack=41634 Win=1966 Len=0 TSval=4070339157 TSecr=86391
596,49.228.168.4,10.0.0.4,[TCP Window Update] 59415 → 3389 [ACK] Seq=15209 Ack=41634 Win=2048 Len=0 TSval=4070339157 TSecr=86391
597,49.228.168.4,10.0.0.4,Application Data
598,49.228.168.4,10.0.0.4,Application Data
599,49.228.168.4,10.0.0.4,Application Data
600,49.228.168.4,10.0.0.4,Application Data
601,10.0.0.4,49.228.168.4,3389 → 59415 [ACK] Seq=41634 Ack=15429 Win=62968 Len=0 TSval=86439 TSecr=4070339156
602,49.228.168.4,10.0.0.4,Application Data
603,10.0.0.4,49.228.168.4,3389 → 59415 [ACK] Seq=41634 Ack=15472 Win=62925 Len=0 TSval=86440 TSecr=4070339160
604,49.228.168.4,10.0.0.4,Application Data
605,49.228.168.4,10.0.0.4,Application Data
606,10.0.0.4,49.228.168.4,3389 → 59415 [ACK] Seq=41634 Ack=15558 Win=62839 Len=0 TSval=86448 TSecr=4070339164
607,49.228.168.4,10.0.0.4,Application Data
608,10.0.0.4,49.228.168.4,Application Data
609,10.0.0.4,49.228.168.4,Application Data
610,10.0.0.4,49.228.168.4,Application Data
611,10.0.0.4,49.228.168.4,Application Data
612,10.0.0.4,49.228.168.4,Application Data
613,10.0.0.4,49.228.168.4,Application Data
614,10.0.0.4,49.228.168.4,Application Data
615,10.0.0.4,49.228.168.4,Application Data
616,49.228.168.4,10.0.0.4,Application Data
617,49.228.168.4,10.0.0.4,Application Data
618,10.0.0.4,49.228.168.4,3389 → 59415 [ACK] Seq=46855 Ack=15687 Win=62710 Len=0 TSval=86461 TSecr=4070339176
619,49.228.168.4,10.0.0.4,Application Data
620,49.228.168.4,10.0.0.4,Application Data
621,10.0.0.4,49.228.168.4,3389 → 59415 [ACK] Seq=46855 Ack=15773 Win=62624 Len=0 TSval=86470 TSecr=4070339185
622,49.228.168.4,10.0.0.4,Application Data
623,49.228.168.4,10.0.0.4,Application Data
624,10.0.0.4,49.228.168.4,3389 → 59415 [ACK] Seq=46855 Ack=15859 Win=64000 Len=0 TSval=86478 TSecr=4070339193
625,49.228.168.4,10.0.0.4,Application Data
626,49.228.168.4,10.0.0.4,Application Data
627,10.0.0.4,49.228.168.4,3389 → 59415 [ACK] Seq=46855 Ack=15945 Win=63914 Len=0 TSval=86487 TSecr=4070339201
628,49.228.168.4,10.0.0.4,Application Data
629,49.228.168.4,10.0.0.4,Application Data
630,10.0.0.4,49.228.168.4,3389 → 59415 [ACK] Seq=46855 Ack=16031 Win=63828 Len=0 TSval=86494 TSecr=4070339210
631,49.228.168.4,10.0.0.4,Application Data
632,49.228.168.4,10.0.0.4,59415 → 3389 [ACK] Seq=16074 Ack=46855 Win=1967 Len=0 TSval=4070339219 TSecr=86455
633,49.228.168.4,10.0.0.4,[TCP Window Update] 59415 → 3389 [ACK] Seq=16074 Ack=46855 Win=2048 Len=0 TSval=4070339219 TSecr=86455
634,49.228.168.4,10.0.0.4,Application Data
635,49.228.168.4,10.0.0.4,Application Data
636,49.228.168.4,10.0.0.4,Application Data
637,49.228.168.4,10.0.0.4,Application Data
638,10.0.0.4,49.228.168.4,3389 → 59415 [ACK] Seq=46855 Ack=16294 Win=63565 Len=0 TSval=86500 TSecr=4070339218
639,49.228.168.4,10.0.0.4,Application Data
640,10.0.0.4,49.228.168.4,3389 → 59415 [ACK] Seq=46855 Ack=16337 Win=63522 Len=0 TSval=86504 TSecr=4070339222
641,49.228.168.4,10.0.0.4,Application Data
642,49.228.168.4,10.0.0.4,Application Data
643,10.0.0.4,49.228.168.4,3389 → 59415 [ACK] Seq=46855 Ack=16423 Win=63436 Len=0 TSval=86510 TSecr=4070339226
644,49.228.168.4,10.0.0.4,Application Data
645,10.0.0.4,49.228.168.4,Application Data
